book_id,authors,title
2664,Ian McEwan,Sweet Tooth
2665,Abbi Glines,"Twisted Perfection (Rosemary Beach, #5; Perfection, #1)"
2666,Tom Clancy,"Executive Orders (Jack Ryan Universe, #9)"
2667,Ann Voskamp,One Thousand Gifts: A Dare to Live Fully Right Where You Are
2668,Robert Bloch,Psycho
2669,Robin Hobb,"Ship of Magic (Liveship Traders, #1)"
2670,"Alistair MacLean, Clint Willis",Where Eagles Dare 
2671,Maeve Binchy,Circle of Friends
2672,Rupi Kaur,Milk and Honey
2673,Tom Clancy,"Rainbow Six (Jack Ryan Universe, #10)"
2674,Neil Gaiman,Fragile Things: Short Fictions and Wonders
2675,Rosamund Lupton,Sister
2676,"Liu Cixin, Ken Liu","The Three-Body Problem (Remembrance of Earth’s Past, #1)"
2677,Terry Pratchett,"Thief of Time (Discworld, #26; Death, #5)"
2678,"Mark Millar, Kilian Plunkett, Andrew Robinson, Walden Wong, Dave Johnson",Superman: Red Son
2679,Julia Glass,Three Junes
2680,"Benjamin Franklin, Lewis Leary",The Autobiography of Benjamin Franklin
2681,Timothy J. Keller,The Reason for God: Belief in an Age of Skepticism
2682,Mark  Lawrence,"King of Thorns (The Broken Empire, #2)"
2683,Jeffrey Archer,"The Sins of the Father (The Clifton Chronicles, #2)"
2684,Meg Cabot,"Shadowland (The Mediator, #1)"
2685,Sara Shepard,"Killer (Pretty Little Liars, #6)"
2686,"W. Chan Kim, Renée Mauborgne",Blue Ocean Strategy: How To Create Uncontested Market Space And Make The Competition Irrelevant
2687,James Patterson,"Fang (Maximum Ride, #6)"
2688,Sarah Addison Allen,The Peach Keeper
2689,"Audrey Wood, Don    Wood",The Napping House
2690,Matthew FitzSimmons,"The Short Drop (Gibson Vaughn, #1)"
2691,Christopher Moore,"You Suck (A Love Story, #2)"
2692,Jamie McGuire,"Beautiful Oblivion (The Maddox Brothers, #1)"
2693,Vernor Vinge,"A Fire Upon the Deep (Zones of Thought, #1)"
2694,Eckhart Tolle,"Practicing the Power of Now: Essential Teachings, Meditations, and Exercises from the Power of Now"
2695,Caroline B. Cooney,"The Face on the Milk Carton (Janie Johnson, #1)"
2696,Robert Lopshire,Put Me in the Zoo
2697,Sophie Jordan,"Firelight (Firelight, #1)"
2698,"Italo Calvino, William Weaver",Invisible Cities
2699,Jessica Park,"Flat-Out Love (Flat-Out Love, #1)"
2700,Richard Flanagan,The Narrow Road to the Deep North
2701,"A.N. Roquelaure, Anne Rice","The Claiming of Sleeping Beauty (Sleeping Beauty, #1)"
2702,Jennifer Worth,"The Midwife: A Memoir of Birth, Joy, and Hard Times"
2703,Hunter S. Thompson,Hell's Angels: A Strange and Terrible Saga
2704,Jennifer Weiner,Then Came You
2705,L.J. Smith,"The Awakening (The Vampire Diaries, #1)"
2706,Susan Elizabeth Phillips,"It Had to Be You (Chicago Stars, #1)"
2707,Michael   Lewis,Boomerang: Travels in the New Third World
2708,Jennifer Weiner,Fly Away Home
2709,"Stendhal, Roger Gard",The Red and the Black
2710,Philippa Gregory,"The Virgin's Lover (The Plantagenet and Tudor Novels, #13)"
2711,Catherine Fisher,"Incarceron (Incarceron, #1)"
2712,C.C. Hunter,"Awake at Dawn (Shadow Falls, #2)"
2713,Bev Vincent,The Road to the Dark Tower: Exploring Stephen King's Magnum Opus
2714,Josephine Angelini,"Starcrossed (Starcrossed, #1)"
2715,Alyson Noel,"Night Star (The Immortals, #5)"
2716,N.H. Kleinbaum,Dead Poets Society
2717,Emily Bleeker,Wreckage
2718,Terry Pratchett,"The Fifth Elephant (Discworld, #24; City Watch, #5)"
2719,John Flanagan,"The Sorcerer in the North (Ranger's Apprentice, #5)"
2720,Paramahansa Yogananda,Autobiography of a Yogi
2721,Kevin Hearne,"Hexed (The Iron Druid Chronicles, #2)"
2722,"Alvin Schwartz, Stephen Gammell","Scary Stories to Tell in the Dark (Scary Stories, #1)"
2723,Harlan Coben,Fool Me Once
2724,John Hersey,Hiroshima
2725,Jennifer Brown,Hate List
2726,Kasie West,The Distance Between Us
2727,Karen Armstrong,"A History of God: The 4,000-Year Quest of Judaism, Christianity, and Islam"
2728,James S.A. Corey,"Abaddon's Gate (The Expanse, #3)"
2729,"Pablo Neruda, W.S. Merwin, Cristina García",Twenty Love Poems and a Song of Despair
2730,Tom Clancy,"The Cardinal of the Kremlin (Jack Ryan Universe, #5)"
2731,David Shannon,"No, David!"
2732,"Thomas More, Paul Turner",Utopia
2733,"Pseudonymous Bosch, Gilbert Ford","The Name of This Book Is Secret (Secret, #1)"
2734,Danielle  Paige,"Dorothy Must Die (Dorothy Must Die, #1)"
2735,Dean Koontz,The Husband
2736,Aimee Bender,The Particular Sadness of Lemon Cake
2737,James Patterson,"The Big Bad Wolf  (Alex Cross, #9)"
2738,"Dai Sijie, Ina Rilke",Balzac and the Little Chinese Seamstress
2739,Roxane Gay,Bad Feminist
2740,V.C. Andrews,"Petals on the Wind (Dollanganger, #2)"
2741,"Roald Dahl, Quentin Blake",Danny the Champion of the World
2742,Amy Chua,Battle Hymn of the Tiger Mother
2743,Noelle Stevenson,Nimona
2744,Giada De Laurentiis,Everyday Italian: 125 Simple and Delicious Recipes
2745,Patricia Cornwell,"From Potter's Field (Kay Scarpetta, #6)"
2746,James Patterson,"Mary, Mary (Alex Cross, #11)"
2747,Jeanette Winterson,Oranges Are Not the Only Fruit
2748,R.K. Lilley,"Grounded (Up in the Air, #3)"
2749,Ravinder Singh,I Too Had a Love Story
2750,"Betty MacDonald, Alexandra Boiger","Mrs. Piggle-Wiggle (Mrs. Piggle Wiggle, #1)"
2751,Michael Connelly,"Trunk Music (Harry Bosch, #5; Harry Bosch Universe, #6)"
2752,Dan   Harris,"10% Happier: How I Tamed the Voice in My Head, Reduced Stress Without Losing My Edge, and Found Self-Help That Actually Works"
2753,"Ina Garten, Quentin Bacon",Barefoot Contessa at Home: Everyday Recipes You'll Make Over and Over Again
2754,Michael Connelly,"Blood Work (Harry Bosch Universe, #8; Terry McCaleb #1)"
2755,Isaac Asimov,The Gods Themselves
2756,Peter Lerangis,"The Viper's Nest (39 Clues, #7)"
2757,Sena Jeter Naslund,"Ahab's Wife, or The Star-Gazer"
2758,"CLAMP, Anthony Gerard","Tsubasa: RESERVoir CHRoNiCLE, Vol. 01"
2759,Darren Shan,"A Living Nightmare (Cirque Du Freak, #1)"
2760,"Alan Moore, Kevin O'Neill","The League of Extraordinary Gentlemen, Vol. 1"
2761,M.T. Anderson,Feed
2762,Nalini Singh,"Angels' Blood (Guild Hunter, #1)"
2763,"Euripides, Rex Warner",Medea
2764,Cinda Williams Chima,"The Demon King (Seven Realms, #1)"
2765,Hannah Hurnard,Hinds' Feet on High Places
2766,Charles Burns,Black Hole
2767,"Brian K. Vaughan, Fiona Staples","Saga, Vol. 3 (Saga, #3)"
2768,Lee Child,"Personal (Jack Reacher, #19)"
2769,Therese Anne Fowler,Z: A Novel of Zelda Fitzgerald
2770,Kurt Vonnegut Jr.,A Man Without a Country
2771,Catherine Ryan Hyde,When I Found You
2772,Martha Hall Kelly,Lilac Girls
2773,"James Patterson, Maxine Paetro","7th Heaven (Women's Murder Club, #7)"
2774,Lee Child,"Make Me (Jack Reacher, #20)"
2775,Anthony Marra,A Constellation of Vital Phenomena
2776,Abbi Glines,"While It Lasts (Sea Breeze, #3)"
2777,Will Schwalbe,The End of Your Life Book Club
2778,Lauren Barnholdt,Two-Way Street
2779,Raine Miller,"All In (The Blackstone Affair, #2)"
2780,John Flanagan,"The Siege of Macindaw (Ranger's Apprentice, #6)"
2781,C.S. Lewis,A Grief Observed
2782,"Warren Ellis, Darick Robertston, Garth Ennis","Transmetropolitan, Vol. 1: Back on the Street (Transmetropolitan, #1)"
2783,Tamora Pierce,"Emperor Mage (Immortals, #3)"
2784,George W. Bush,Decision Points
2785,"James Patterson, Gabrielle Charbonnet","Witch & Wizard (Witch & Wizard, #1)"
2786,"Jean Craighead George, John Schoenherr","Julie of the Wolves (Julie of the Wolves, #1)"
2787,Judy Blume,Forever . . .
2788,David McCullough,The Wright Brothers
2789,Robert Ludlum,The Matarese Circle (Matarese #1)
2790,Jon Meacham,American Lion: Andrew Jackson in the White House
2791,David Baldacci,"The Forgotten (John Puller, #2)"
2792,Brandon Sanderson,"Shadows of Self (Mistborn, #5)"
2793,Helen Fielding,"Mad About the Boy (Bridget Jones, #3)"
2794,C.S. Lewis,The Four Loves
2795,Mia Sheridan,Archer's Voice
2796,Alyson Richman,The Lost Wife
2797,"Umberto Eco, Girolamo De Michele, Alastair McEwen",History of Beauty
2798,Robert Graves,"I, Claudius (Claudius, #1)"
2799,Joelle Charbonneau,"The Testing (The Testing, #1)"
2800,Janet Evanovich,"Takedown Twenty (Stephanie Plum, #20)"
2801,Kirsty Moseley,The Boy Who Sneaks in My Bedroom Window
2802,Tamora Pierce,"Terrier (Beka Cooper, #1)"
2803,Darynda Jones,"First Grave on the Right (Charley Davidson, #1)"
2804,"Amanda Lindhout, Sara Corbett",A House in the Sky
2805,Vera Brosgol,Anya's Ghost
2806,Bret Easton Ellis,The Rules of Attraction
2807,Kim Harrison,"The Good, the Bad, and the Undead (The Hollows, #2)"
2808,R.A. Salvatore,"The Crystal Shard (Forgotten Realms: Icewind Dale, #1; Legend of Drizzt, #4)"
2809,Jean Rhys,Wide Sargasso Sea
2810,John Fowles,The Magus
2811,David Eddings,"King of the Murgos (The Malloreon, #2)"
2812,Louise Rennison,"On the Bright Side, I'm Now the Girlfriend of a Sex God (Confessions of Georgia Nicolson, #2)"
2813,Caroline Kepnes,"You (You, #1)"
2814,Laini Taylor,"Dreams of Gods & Monsters (Daughter of Smoke & Bone, #3)"
2815,John Grisham,Playing for Pizza
2816,Colleen Houck,"Tiger's Curse (The Tiger Saga, #1)"
2817,Frank Herbert,Chapterhouse: Dune (Dune Chronicles #6)
2818,Jacqueline Woodson,Brown Girl Dreaming
2819,Mira Grant,"Feed (Newsflesh Trilogy, #1)"
2820,Gwyn Hyman Rubio,Icy Sparks
2821,L.M. Montgomery,"Anne's House of Dreams (Anne of Green Gables, #5)"
2822,Steve Berry,"The Templar Legacy (Cotton Malone, #1)"
2823,Sue Grafton,"J is for Judgment (Kinsey Millhone, #10)"
2824,Katherine Howe,The Physick Book of Deliverance Dane
2825,Steven Erikson,"Deadhouse Gates (The Malazan Book of the Fallen, #2)"
2826,Kylie Scott,"Lick (Stage Dive, #1)"
2827,Jeffrey Archer,"Not a Penny More, Not a Penny Less"
2828,Joe Abercrombie,Best Served Cold
2829,Emma Healey,Elizabeth Is Missing
2830,Vince Flynn,"Consent to Kill (Mitch Rapp, #8)"
2831,Isabel Wilkerson,The Warmth of Other Suns: The Epic Story of America's Great Migration
2832,Claire North,The First Fifteen Lives of Harry August
2833,Carlos Ruiz Zafón,"The Prisoner of Heaven (The Cemetery of Forgotten Books, #3)"
2834,"Barbara W. Tuchman, Robert K. Massie",The Guns of August
2835,Vince Flynn,"Separation of Power (Mitch Rapp, #5)"
2836,John Marsden,"Tomorrow, When the War Began (Tomorrow, #1)"
2837,"Robert M. Edsel, Bret Witter","The Monuments Men: Allied Heroes, Nazi Thieves, and the Greatest Treasure Hunt in History"
2838,Ava Dellaira,Love Letters to the Dead
2839,Helen Bryan,War Brides
2840,Yaa Gyasi,Homegoing
2841,Mary Roach,Packing for Mars: The Curious Science of Life in the Void
2842,David Baldacci,"Divine Justice (Camel Club, #4)"
2843,"Mark Millar, John Romita Jr., Rob Liefeld","Kick-Ass (Kick-Ass, #1)"
2844,"Immaculée Ilibagiza, Steve Erwin",Left to Tell: Discovering God Amidst the Rwandan Holocaust
2845,Michael  Grant,"Plague (Gone, #4)"
2846,Charles Dickens,Hard Times
2847,Joël Dicker,La Vérité sur l'affaire Harry Quebert
2848,Kate Atkinson,A God in Ruins
2849,Harlan Coben,Caught
2850,Maria V. Snyder,"Magic Study (Study, #2)"
2851,"CLAMP, Shirley Kubo","Chobits, Vol. 1"
2852,"Koushun Takami, Yuji Oniki",Battle Royale
2853,Sarah Addison Allen,The Girl Who Chased the Moon
2854,Nevil Shute,A Town Like Alice
2855,Sophia Amoruso,#GIRLBOSS
2856,Diane Chamberlain,The Secret Life of CeeCee Wilkes
2857,Elizabeth Peters,Crocodile on the Sandbank (Amelia Peabody #1)
2858,Nora Roberts,"Bed of Roses (Bride Quartet, #2)"
2859,Tom Clancy,"Debt of Honor (Jack Ryan Universe, #8)"
2860,C.S. Lewis,Till We Have Faces
2861,Anthony Horowitz,"Point Blank (Alex Rider, #2)"
2862,Dean Koontz,Strangers
2863,Daniel Silva,"The Kill Artist (Gabriel Allon, #1)"
2864,Mo Willems,"Knuffle Bunny: A Cautionary Tale (Knuffle Bunny, #1)"
2865,Edward Gorey,"The Gashlycrumb Tinies (The Vinegar Works, #1)"
2866,"Terry Pratchett, Stephen Baxter","The Long Earth (The Long Earth, #1)"
2867,"Steven Pressfield, Robert McKee",The War of Art: Break Through the Blocks & Win Your Inner Creative Battles
2868,Abbi Glines,"Existence (Existence Trilogy, #1)"
2869,Raymond Carver,What We Talk About When We Talk About Love
2870,Sarah Dessen,That Summer
2871,Michael J. Sullivan,"Theft of Swords (The Riyria Revelations, #1-2)"
2872,Diane Chamberlain,"Necessary Lies (Necessary Lies, #1)"
2873,"Larry Niven, Jerry Pournelle",Lucifer's Hammer
2874,Nora Roberts,Montana Sky
2875,"W. Somerset Maugham, Benjamin DeMott, Maeve Binchy",Of Human Bondage
2876,Gayle Forman,I Was Here
2877,"A.A. Milne, Ernest H. Shepard","The Complete Tales and Poems of Winnie-the-Pooh (Winnie-the-Pooh, #1-4)"
2878,Lisa Gardner,"Alone (Detective D.D. Warren, #1)"
2879,Virginia Lee Burton,Mike Mulligan and His Steam Shovel
2880,Veronica Roth,"Divergent Series Complete Box Set (Divergent, #1-3)"
2881,Terry Pratchett,"Making Money (Discworld, #36; Moist Von Lipwig, #2)"
2882,Nora Roberts,"Happy Ever After (Bride Quartet, #4)"
2883,Jodi Picoult,Harvesting the Heart
2884,Alexandra Bracken,"Never Fade (The Darkest Minds, #2)"
2885,"Vicki Myron, Bret Witter",Dewey: The Small-Town Library Cat Who Touched the World
2886,Soman Chainani,"The School for Good and Evil (The School for Good and Evil, #1)"
2887,Kim Harrison,"For a Few Demons More (The Hollows, #5)"
2888,Tana French,"The Secret Place (Dublin Murder Squad, #5)"
2889,Brandon Sanderson,"Mistborn Trilogy Boxed Set (Mistborn, #1-3)"
2890,Jeffery Deaver,"The Coffin Dancer (Lincoln Rhyme, #2)"
2891,Gordon Korman,"The Emperor's Code (The 39 Clues, #8)"
2892,"Margret Rey, H.A. Rey",The Complete Adventures of Curious George
2893,Michael Connelly,"The Drop (Harry Bosch, #17; Harry Bosch Universe, #21)"
2894,Naoko Takeuchi,"Sailor Moon, #1 (Sailor Moon, #1)"
2895,"Steven D. Levitt, Stephen J. Dubner",Think Like a Freak
2896,"Raina Telgemeier, Gurihiru",Drama
2897,Sarah Vowell,Assassination Vacation
2898,Roger Zelazny,Nine Princes in Amber (The Chronicles of Amber #1)
2899,Alice Hoffman,The Museum of Extraordinary Things
2900,Orson Scott Card,"Ender in Exile (Ender's Saga, #1.2)"
2901,MaryJanice Davidson,"Undead and Unwed (Undead, #1)"
2902,Paulo Coelho,The Fifth Mountain
2903,"Joseph Campbell, Bill Moyers",The Power of Myth
2904,John Scalzi,"Lock In (Lock In, #1)"
2905,Jo Baker,Longbourn
2906,"Cary Elwes, Joe Layden, Various, Rob Reiner",As You Wish: Inconceivable Tales from the Making of The Princess Bride
2907,Peggy Rathmann,"Good Night, Gorilla"
2908,Robyn Schneider,The Beginning of Everything
2909,Jude Watson,"In Too Deep (The 39 Clues, #6)"
2910,"Frank W. Abagnale, Stan Redding",Catch Me If You Can: The True Story of a Real Fake
2911,Laurell K. Hamilton,"Narcissus in Chains (Anita Blake, Vampire Hunter, #10)"
2912,Gary Zukav,The Seat of the Soul
2913,J. Kenner,"Claim Me (Stark Trilogy, #2)"
2914,Marisha Pessl,Special Topics in Calamity Physics
2915,Josh Malerman,Bird Box
2916,Dan Wells,"Partials (Partials Sequence, #1)"
2917,Timothy Egan,The Worst Hard Time: The Untold Story of Those Who Survived the Great American Dust Bowl
2918,Ellen Marie Wiseman,What She Left Behind
2919,Sara Shepard,"Wicked (Pretty Little Liars, #5)"
2920,Vince Flynn,"Transfer of Power (Mitch Rapp, #3)"
2921,Sylvia Plath,Ariel
2922,"Scott Snyder, Greg Capullo, Jonathan Glapion","Batman, Volume 1: The Court of Owls"
2923,Christopher Moore,"Practical Demonkeeping (Pine Cove, #1)"
2924,Raymond Khoury,"The Last Templar (Templar, #1)"
2925,Kathy Griffin,Official Book Club Selection: A Memoir According to Kathy Griffin
2926,"Milan Kundera, Aaron Asher",The Book of Laughter and Forgetting
2927,Nicholas Evans,The Horse Whisperer
2928,Sherry Argov,Why Men Love Bitches: From Doormat to Dreamgirl—A Woman's Guide to Holding Her Own in a Relationship
2929,Sara Shepard,"Wanted (Pretty Little Liars, #8)"
2930,Kim Harrison,"The Outlaw Demon Wails (The Hollows, #6)"
2931,"Edwin A. Abbott, Banesh Hoffmann",Flatland: A Romance of Many Dimensions
2932,Libba Bray,"The Diviners (The Diviners, #1)"
2933,Tim Tharp,The Spectacular Now
2934,"Erich Fromm, Peter D. Kramer, Rainer Funk",The Art of Loving
2935,Suzanne Collins,"Gregor and the Code of Claw (Underland Chronicles, #5)"
2936,Terry Pratchett,"Eric (Discworld, #9; Rincewind #4)"
2937,"Neil Gaiman, Shawn McManus, Colleen Doran, Bryan Talbot, George Pratt, Stan Woch, Dick Giordano, Todd Klein",A Game of You (The Sandman #5)
2938,Marian Keyes,The Other Side of the Story
2939,Pat Conroy,Beach Music
2940,Francine Rivers,"An Echo in the Darkness (Mark of the Lion, #2)"
2941,Mary E. Pearson,"The Kiss of Deception (The Remnant Chronicles, #1)"
2942,James Clavell,"Tai-Pan (Asian Saga, #2)"
2943,Eleanor Brown,The Weird Sisters
2944,Terry Pratchett,"The Truth (Discworld, #25; Industrial Revolution, #2)"
2945,Tom Perrotta,The Leftovers
2946,Mihaly Csikszentmihalyi,Flow: The Psychology of Optimal Experience
2947,"Margaret Weis, Tracy Hickman","Dragons of Winter Night (Dragonlance: Chronicles, #2)"
2948,Portia de Rossi,Unbearable Lightness: A Story of Loss and Gain
2949,Lisa Kleypas,"Mine Till Midnight (The Hathaways, #1)"
2950,"Carl Bernstein, Bob Woodward",All the President's Men
2951,Andrea Cremer,Wolfsbane (Nightshade #2; Nightshade World #5)
2952,"George Eliot, A.S. Byatt",The Mill on the Floss
2953,Gary Shteyngart,Super Sad True Love Story
2954,Robin McKinley,"The Blue Sword (Damar, #1)"
2955,J.R. Ward,"Lover at Last (Black Dagger Brotherhood, #11)"
2956,"Michelle Rowen, Richelle Mead",Vampire Academy: The Ultimate Guide (Vampire Academy)
2957,C.S. Lewis,Surprised by Joy: The Shape of My Early Life
2958,Douglas R. Hofstadter,"Gödel, Escher, Bach: An Eternal Golden Braid"
2959,Tamora Pierce,"Trickster's Queen (Daughter of the Lioness, #2)"
2960,"Robert Frost, Edward Connery Lathem","The Poetry of Robert Frost (Collected Poems, Complete & Unabridged)"
2961,Rodman Philbrick,"Freak the Mighty (Freak The Mighty, #1)"
2962,Jennifer E. Smith,"This Is What Happy Looks Like (This is What Happy Looks Like, #1)"
2963,Philip Yancey,What's So Amazing About Grace?
2964,Vince Flynn,"Kill Shot (Mitch Rapp, #2)"
2965,Jean M. Auel,"The Plains of Passage (Earth's Children, #4)"
2966,Jeff Kinney,"Hard Luck (Diary of a Wimpy Kid, #8)"
2967,"Åsne Seierstad, Ingrid Christopherson",The Bookseller of Kabul
2968,D.J. MacHale,"The Merchant of Death (Pendragon, #1)"
2969,China Miéville,The City & the City
2970,Kathy Reichs,"Fatal Voyage (Temperance Brennan, #4)"
2971,Ilona Andrews,"Magic Strikes (Kate Daniels, #3)"
2972,Chelsea M. Cameron,"My Favorite Mistake (My Favorite Mistake, #1)"
2973,Arthur Hailey,Airport
2974,James Patterson,"Angel (Maximum Ride, #7)"
2975,"Harold Bloom, Terry Southern, David H. Goldsmith, James Lundquist, Lawrence R. Broer, Peter J. Reed, Loree Rackstraw, William S. Doxey, Jerome Klinkowitz, Richard Giannone, John L. Simons, Leonard Mustazza, Zoltan Ab di-Nagy, Peter Freese, Wendy B. Faris",Kurt Vonnegut's Cat's Cradle (Modern Critical Interpretations)
2976,"Beverly Cleary, Alan Tiegreen","Ramona the Brave (Ramona, #3)"
2977,Timothy Zahn,The Last Command
2978,Brandon Sanderson,The Emperor's Soul
2979,Stephen King,Just After Sunset
2980,Patricia McCormick,Sold
2981,James Patterson,"Double Cross (Alex Cross, #13)"
2982,"Alexander Pushkin, James E. Falen",Eugene Onegin
2983,"Amie Kaufman, Meagan Spooner","These Broken Stars (Starbound, #1)"
2984,Alison Goodman,"Eon: Dragoneye Reborn (Eon, #1)"
2985,E.L. Konigsburg,The View from Saturday
2986,"P.C. Cast, Kristin Cast","Hidden (House of Night, #10)"
2987,Rachel Hawkins,"Spell Bound (Hex Hall, #3)"
2988,"Carolyn Keene, Russell H. Tandy, Sara Paretsky","The Secret of the Old Clock (Nancy Drew, #1)"
2989,Nelson DeMille,"Plum Island (John Corey, #1)"
2990,"Hugh Lofting, Michael Hague","The Story of Doctor Dolittle (Doctor Dolittle, #1)"
2991,Jodi Picoult,Second Glance
2992,Arnold Lobel,"Frog and Toad Together (Frog and Toad, #2)"
2993,Shirley Jackson,The Lottery
2994,Adriana Trigiani,"Big Stone Gap (Big Stone Gap, #1)"
2995,Steve Berry,"The Alexandria Link (Cotton Malone, #2)"
2996,Kelley Armstrong,"The Gathering (Darkness Rising, #1)"
2997,Richelle Mead,"The Fiery Heart (Bloodlines, #4)"
2998,Ilona Andrews,"Magic Bleeds (Kate Daniels, #4)"
2999,"Isabel Allende, Nick Caistor, Amanda Hopkinson",The Japanese Lover
3000,Terry Pratchett,"Jingo (Discworld, #21; City Watch, #4)"
3001,Lara Adrian,"Kiss of Midnight (Midnight Breed,  #1)"
3002,"D.H. Lawrence, Geoff Dyer",Sons and Lovers
3003,Barbara Taylor Bradford,A Woman of Substance (Emma Harte Saga #1)
3004,Nicole  Williams,"Crash (Crash, #1)"
3005,David Baldacci,"The Hit (Will Robie, #2)"
3006,William Gibson,"Count Zero (Sprawl, #2)"
3007,Lisa See,Peony in Love
3008,Sarah Ockler,Twenty Boy Summer
3009,"Robert T. Kiyosaki, Sharon L. Lechter",Rich Dad's Cashflow Quadrant: Rich Dad's Guide to Financial Freedom
3010,"Camilla Läckberg, Steven T. Murray","The Ice Princess (Patrik Hedström, #1)"
3011,Jane Green,Bookends
3012,Donna Mabry,Maude
3013,John Scalzi,The Last Colony (Old Man's War #3)
3014,"Laura Joffe Numeroff, Felicia Bond",If You Take a Mouse to School
3015,Colleen Hoover,"Finding Cinderella (Hopeless, #2.5)"
3016,Marian Keyes,Last Chance Saloon
3017,Georgia Cates,"Beauty from Pain (Beauty, #1)"
3018,Mary Higgins Clark,Where Are the Children?
3019,Robin McKinley,"The Hero and the Crown (Damar, #2)"
3020,"Franz Kafka, Jason Baker, Donna Freed",The Metamorphosis and Other Stories
3021,Thrity Umrigar,The Space Between Us
3022,"Unknown, Burton Raffel, Neil D. Isaacs",Sir Gawain and the Green Knight 
3023,Jerome K. Jerome,"Three Men in a Boat (Three Men, #1)"
3024,Edward Abbey,Desert Solitaire
3025,Janet Evanovich,"Plum Lovin' (Stephanie Plum, #12.5)"
3026,Tom Rath,Strengths Finder 2.0
3027,Tom Robbins,Another Roadside Attraction
3028,Edward Rutherfurd,Sarum: The Novel of England
3029,Sidney Sheldon,Rage of Angels
3030,Richelle Mead,"Vampire Academy Box Set (Vampire Academy, #1-4)"
3031,Alyson Noel,"Everlasting (The Immortals, #6)"
3032,Bella Forrest,"A Shade of Vampire (A Shade of Vampire, #1)"
3033,Tom Wolfe,The Right Stuff
3034,Madeleine Wickham,Cocktails for Three
3035,Tess Gerritsen,"Vanish (Rizzoli & Isles, #5)"
3036,Christopher Moore,"Fluke: Or, I Know Why the Winged Whale Sings"
3037,"Edgar Allan Poe, Byron Glaser, Bill D. Fountain",The Tell-Tale Heart
3038,Jean Kwok,Girl in Translation
3039,Lauren Oliver,"Panic (Panic, #1)"
3040,Abbi Glines,"Because of Low (Sea Breeze, #2)"
3041,"Leonardo da Vinci, H. Anna Suh",Leonardo's Notebooks
3042,Kristin Hannah,Between Sisters
3043,Blake Crouch,"Wayward (Wayward Pines, #2)"
3044,"Angie Sage, Mark Zug","Queste (Septimus Heap, #4)"
3045,Sophie Kinsella,Finding Audrey
3046,Mollie Katzen,"The Moosewood Cookbook: Recipes from Moosewood Restaurant, Ithaca, New York"
3047,Dr. Seuss,Fox in Socks
3048,"Orhan Pamuk, Erdağ M. Göknar",My Name is Red
3049,Carlos Castaneda,The Teachings of Don Juan: A Yaqui Way of Knowledge 
3050,David Baldacci,"The Sixth Man (Sean King & Michelle Maxwell, #5)"
3051,Marcia Brown,Stone Soup
3052,Cinda Williams Chima,"The Warrior Heir (The Heir Chronicles, #1)"
3053,Janet Evanovich,"Top Secret Twenty-One (Stephanie Plum, #21)"
3054,John   Williams,Harry Potter and the Chamber of Secrets: Sheet Music for Flute with C.D
3055,"Neil Gaiman, Chris Bachalo, Mark Buckingham, Tori Amos",Death: The High Cost of Living Collected
3056,Catherine Marshall,Christy
3057,Tahereh Mafi,"Destroy Me (Shatter Me, #1.5)"
3058,Lisa Gardner,"Gone (Quincy & Rainie, #5)"
3059,Carol S. Dweck,Mindset: The New Psychology of Success
3060,Jude Watson,Beyond the Grave (The 39 Clues #4)
3061,C.S. Lewis,The Problem of Pain
3062,"Richard H. Thaler, Cass R. Sunstein","Nudge: Improving Decisions About Health, Wealth, and Happiness"
3063,Susan Cooper,"The Dark Is Rising (The Dark is Rising, #2)"
3064,Jonathan Franzen,Purity
3065,"Richard Paige, Dean Koontz",The Door to December
3066,James Patterson,"Four Blind Mice (Alex Cross, #8)"
3067,Kristin Hannah,True Colors
3068,Kurt Vonnegut Jr.,"Slapstick, or Lonesome No More!"
3069,Nassim Nicholas Taleb,Fooled by Randomness: The Hidden Role of Chance in Life and in the Markets
3070,Kate Mosse,"Labyrinth (Languedoc, #1)"
3071,Joseph J. Ellis,Founding Brothers: The Revolutionary Generation
3072,Isaac Asimov,Forward the Foundation (Foundation: Prequel #2)
3073,Kerstin Gier,"Saphirblau (Edelstein-Trilogie, #2)"
3074,Lawrence Wright,"Going Clear: Scientology, Hollywood, and the Prison of Belief"
3075,"Young Kim, Stephenie Meyer","Twilight: The Graphic Novel, Vol. 1 (Twilight: The Graphic Novel, #1)"
3076,John Fowles,The French Lieutenant's Woman
3077,"Samuel Taylor Coleridge, Gustave Doré",The Rime of the Ancient Mariner
3078,"Robert Munsch, Michael Martchenko",The Paper Bag Princess
3079,John Steinbeck,Tortilla Flat
3080,H. Rider Haggard,"King Solomon's Mines (Allan Quatermain, #1)"
3081,Tina Reber,"Love Unrehearsed (Love, #2)"
3082,"Neil Gaiman, Jill Thompson, Vince Locke, Peter Straub",Brief Lives (The Sandman #7)
3083,L.J. Smith,"Nightfall (The Vampire Diaries: The Return, #1)"
3084,Jeanne DuPrau,"The People of Sparks (Book of Ember, #2)"
3085,"Hermann Hesse, Ursule Molinaro",Narcissus and Goldmund
3086,"Neil Gaiman, Bryan Talbot, Stan Woch, P. Craig Russell, Shawn McManus, John Watkiss, Jill Thompson, Duncan Eagleson, Kent Williams, Todd Klein",Fables and Reflections (The Sandman #6)
3087,Samantha Shannon,"The Bone Season (The Bone Season, #1)"
3088,"Charles Dickens, Helen Small, Stephen Wall",Little Dorrit
3089,Anthony Horowitz,"Eagle Strike (Alex Rider, #4)"
3090,Jacqueline Susann,Valley of the Dolls
3091,James A. Michener,The Source
3092,Dave Eggers,You Shall Know Our Velocity!
3093,"Radwa Ashour, رضوى عاشور",ثلاثية غرناطة
3094,"Michael Rosen, Helen Oxenbury",We're Going on a Bear Hunt
