book_id,authors,title
5215,Anne Lamott,Plan B: Further Thoughts on Faith
5216,Sarah Dunant,In the Company of the Courtesan
5217,Peter V. Brett,"The Skull Throne (Demon Cycle, #4)"
5218,Sherrilyn Kenyon,"Devil May Cry (Dark-Hunter, #11)"
5219,Nicholas Sparks,Two By Two
5220,Anita Shreve,Sea Glass
5221,Shannon Hale,"River Secrets (The Books of Bayern, #3)"
5222,Jeffrey Archer,"Be Careful What You Wish For (The Clifton Chronicles, #4)"
5223,Amy A. Bartol,"Inescapable (The Premonition, #1)"
5224,Aprilynne Pike,"Illusions (Wings, #3)"
5225,Joe McGinniss,Fatal Vision
5226,Sudhir Venkatesh,Gang Leader for a Day: A Rogue Sociologist Takes to the Streets
5227,"Raymond E. Feist, Michael Avon Oeming, Bryan J.L. Glass, Ryan Stegman",Magician: Apprentice  (Raymond E. Feist's Magician: Apprentice #1)
5228,John C. Maxwell,Developing the Leader Within You
5229,C.S. Lewis,"That Hideous Strength (Space Trilogy, #3)"
5230,Laline Paull,The Bees
5231,Sara Gruen,Ape House
5232,"David Eddings, Leigh Eddings",Polgara the Sorceress (Malloreon)
5233,Kevin Kwan,China Rich Girlfriend (Crazy Rich Asians #2)
5234,Elizabeth George,A Woman After God's Own Heart
5235,Brad Thor,"State of the Union (Scot Harvath, #3)"
5236,Ann Leary,The Good House
5237,Rudolfo Anaya,"Bless Me, Ultima"
5238,Bret Easton Ellis,Glamorama
5239,Sue Grafton,"F is for Fugitive (Kinsey Millhone, #6)"
5240,Jo Nesbø,"The Redeemer (Harry Hole, #6)"
5241,Alessandro Baricco,Silk
5242,Tatiana de Rosnay,A Secret Kept
5243,"Tim LaHaye, Jerry B. Jenkins","The Remnant (Left Behind, #10)"
5244,"Italo Calvino, Archibald Colquhoun",The Baron in the Trees
5245,"Stephenie Meyer, Young Kim","Twilight: The Graphic Novel, Vol. 2  (Twilight: The Graphic Novel, #2)"
5246,Belle Aurora,"Raw (RAW Family, #1)"
5247,Roger Zelazny,"The Great Book of Amber (The Chronicles of Amber, #1-10)"
5248,Gena Showalter,The Darkest Lie (Lords of the Underworld #6)
5249,Andrzej Sapkowski,"Czas pogardy (Saga o Wiedźminie, #4)"
5250,Jillian Dodd,"That Boy (That Boy, #1)"
5251,Kate Alcott,The Dressmaker
5252,Judith McNaught,"Paradise (Second Opportunities, #1)"
5253,Chris Van Allsburg,Jumanji
5254,Ken Grimwood,Replay
5255,David Eagleman,Incognito: The Secret Lives of the Brain
5256,Neil deGrasse Tyson,Death by Black Hole - And Other Cosmic Quandaries
5257,Margaret Atwood,The Edible Woman
5258,Richard Dawkins,The Ancestor's Tale: A Pilgrimage to the Dawn of Evolution
5259,Marissa Meyer,Heartless
5260,Paul Zindel,"The Pigman (The Pigman, #1)"
5261,Lincoln Child,"Deep Storm (Jeremy Logan, #1)"
5262,Meg Cabot,"Abandon (Abandon, #1)"
5263,Alexander McCall Smith,"The Full Cupboard of Life (No. 1 Ladies' Detective Agency, #5)"
5264,Kerrelyn Sparks,"How to Marry a Millionaire Vampire (Love at Stake, #1)"
5265,Dr. Seuss,The Foot Book: Dr. Seuss's Wacky Book of Opposites (Bright and Early Board Books)
5266,Christina Lauren,"Beautiful Bitch (Beautiful Bastard, #1.5)"
5267,Robert Muchamore,"The Recruit (Cherub, #1)"
5268,Sarah Simblet,Anatomy for the Artist
5269,Simon Singh,Fermat's Enigma: The Epic Quest to Solve the World's Greatest Mathematical Problem
5270,Richard Paul Evans,"The Christmas Box (The Christmas Box, #1)"
5271,Amanda Hocking,"My Blood Approves (My Blood Approves, #1)"
5272,Aurora Rose Reynolds,"Until November (Until, #1)"
5273,Angela Carter,The Bloody Chamber and Other Stories
5274,Anthony Bourdain,A Cook's Tour: Global Adventures in Extreme Cuisines
5275,Simon Schama,The Power of Art
5276,"Michelle Knight, Michelle Burford","Finding Me: A Decade of Darkness, a Life Reclaimed - A Memoir of the Cleveland Kidnappings"
5277,Nora Roberts,"Born in Shame (Born In Trilogy, #3)"
5278,Simone Elkeles,"Return to Paradise (Leaving Paradise, #2)"
5279,Jasmine Warga,My Heart and Other Black Holes
5280,Kim Gordon,Girl in a Band
5281,Heather Brewer,"Ninth Grade Slays (The Chronicles of Vladimir Tod, #2)"
5282,Patricia Cornwell,"Book of the Dead (Kay Scarpetta, #15)"
5283,Joseph Campbell,The Hero With a Thousand Faces
5284,John Sandford,"Bad Blood (Virgil Flowers, #4)"
5285,"D.C. Talk, The Voice of the Martyrs","Jesus Freaks: Stories of Those Who Stood for Jesus, the Ultimate Jesus Freaks (Jesus Freaks, #1)"
5286,Michael Pollan,Cooked: A Natural History of Transformation
5287,Anne Bishop,Daughter of the Blood (The Black Jewels #1)
5288,Orson Scott Card,"The Lost Gate (Mither Mages, #1)"
5289,"Jo Nesbø, Don Bartlett","Police (Harry Hole, #10)"
5290,Anne Rice,"Vittorio, The Vampire (New Tales of the Vampires, #2)"
5291,"Yuu Watase, Yuji Oniki","Fushigi Yûgi: The Mysterious Play, Vol. 1: Priestess"
5292,Brunonia Barry,"The Lace Reader (The Lace Reader, #1)"
5293,"Faye Perozich, Travis Moore, Michael Halbleib, Daerick Gröss, Anne Rice",Anne Rice's The Tale of the Body Thief (A Graphic Novel)
5294,Sherman Alexie,The Lone Ranger and Tonto Fistfight in Heaven
5295,Laurell K. Hamilton,"A Stroke of Midnight (Merry Gentry, #4)"
5296,Stephenie Meyer,The Chemist
5297,Anchee Min,"Empress Orchid (Empress Orchid, #1)"
5298,Eoin Colfer,And Another Thing...
5299,Kathy Reichs,"Monday Mourning (Temperance Brennan, #7)"
5300,H.M. Ward,"Damaged (Damaged, #1)"
5301,"George MacDonald, Arthur Hughes","The Princess and the Goblin  (Princess Irene and Curdie, #1)"
5302,"Camilla Läckberg, Steven T. Murray","The Preacher (Patrik Hedström, #2)"
5303,Dr. Seuss,There's a Wocket in My Pocket!
5304,Dean Koontz,Midnight
5305,Madeleine Wickham,The Gatecrasher
5306,Neal Stephenson,"The Confusion (The Baroque Cycle, #2)"
5307,Terry Pratchett,"Raising Steam (Discworld, #40, Moist von Lipwig #3 )"
5308,Joelle Charbonneau,"Independent Study (The Testing, #2)"
5309,Sue Grafton,"X (Kinsey Millhone, #24)"
5310,"Roger Zelazny, Sönmez Güven",Lord of Light
5311,"Roald Dahl, Quentin Blake",Esio Trot
5312,Mike Mignola,"Hellboy, Vol. 3: The Chained Coffin and Others (Hellboy, #3)"
5313,Scott B. Smith,A Simple Plan
5314,"James Patterson, Michael Ledwidge","Run for Your Life (Michael Bennett, #2)"
5315,"Joan Didion, David Thomson",Play It as It Lays
5316,Kelley Armstrong,"Dime Store Magic (Women of the Otherworld, #3)"
5317,Kim Stanley Robinson,"Blue Mars (Mars Trilogy, #3)"
5318,"Paulo Coelho, Alan R. Clarke",The Valkyries
5319,Louise Penny,"The Long Way Home (Chief Inspector Armand Gamache, #10)"
5320,A.S. King,Please Ignore Vera Dietz
5321,"Joseph Delaney, Patrick  Arrasmith","Curse of the Bane (The Last Apprentice / Wardstone Chronicles, #2)"
5322,L.J. Smith,"The Struggle (The Vampire Diaries, #2)"
5323,Karen Marie Moning,"The Dark Highlander (Highlander, #5)"
5324,Karen Marie Moning,"The Immortal Highlander (Highlander, #6)"
5325,Reza Aslan,"No god but God: The Origins, Evolution and Future of Islam"
5326,Philip K. Dick,"VALIS (VALIS Trilogy, #1)"
5327,"Simone de Beauvoir, H.M. Parshley, Deirdre Bair",The Second Sex
5328,Jennifer A. Nielsen,"The Runaway King (The Ascendance Trilogy, #2)"
5329,"Margaret Weis, Tracy Hickman","Dragon Wing (The Death Gate Cycle, #1)"
5330,Kurt Vonnegut Jr.,Jailbird
5331,"Brian K. Vaughan, Pia Guerra, Goran Sudžuka, José Marzán Jr.","Y: The Last Man, Vol. 9: Motherland (Y: The Last Man, #9)"
5332,Dan Simmons,"Ilium (Ilium, #1)"
5333,"Noelle Stevenson, Grace Ellis, Shannon Waters, Shannon Watters, Brooke A. Allen, Faith Hicks, Kat Leyh, Brooke Allen, Carolyn Nowak, Various, Carey Pietsch","Lumberjanes, Vol. 1: Beware the Kitten Holy"
5334,Elaine N. Aron,The Highly Sensitive Person: How to Thrive When the World Overwhelms You
5335,Chitra Banerjee Divakaruni,The Palace of Illusions
5336,H.W. Brands,The First American: The Life and Times of Benjamin Franklin
5337,"Douglas Preston, Lincoln Child","Dance of Death (Pendergast, #6; Diogenes, #2)"
5338,Susan Beth Pfeffer,"This World We Live In (Last Survivors, #3)"
5339,"Yoshihiro Togashi, 冨樫 義博","Hunter x Hunter, Vol. 01 (Hunter x Hunter, #1)"
5340,J.D. Robb,"Vengeance in Death (In Death, #6)"
5341,Connie Willis,"To Say Nothing of the Dog (Oxford Time Travel, #2)"
5342,"James Patterson, Ned Rust","The Gift (Witch & Wizard, #2)"
5343,Michael Crichton,The Terminal Man
5344,"Daniel Abraham, George R.R. Martin, Tommy Patterson","A Game of Thrones: Comic Book, Issue 1"
5345,Holly Black,"White Cat (Curse Workers, #1)"
5346,Raymond Carver,Where I'm Calling From: New and Selected Stories
5347,Jasper Fforde,"Something Rotten (Thursday Next, #4)"
5348,Jean M. Auel,"The Land of Painted Caves (Earth's Children, #6)"
5349,Lucy Grealy,Autobiography of a Face
5350,Lauren Oliver,Vanishing Girls
5351,Walt Disney Company,Snow White and the Seven Dwarfs (Little Golden Book)
5352,"Angie Sage, Mark Zug","Darke (Septimus Heap, #6)"
5353,Jeff Kinney,The Wimpy Kid Movie Diary (Diary of a Wimpy Kid)
5354,Dashiell Hammett,The Thin Man
5355,Candace Bushnell,Trading Up
5356,David Brin,"The Uplift War (The Uplift Saga, #3)"
5357,Raymond E. Feist,"Rage of a Demon King (The Serpentwar Saga, #3)"
5358,"Kingsley Amis, David Lodge",Lucky Jim
5359,Karin Slaughter,"A Faint Cold Fear (Grant County, #3)"
5360,Marie Lu,"The Rose Society (The Young Elites, #2)"
5361,Kristin Hannah,Angel Falls
5362,Susane Colasanti,Waiting For You
5363,Jeff Hobbs,The Short and Tragic Life of Robert Peace: A Brilliant Young Man Who Left Newark for the Ivy League
5364,Li Cunxin,Mao's Last Dancer
5365,Lisa Gardner,"The Neighbor (Detective D.D. Warren, #3)"
5366,"Brian K. Vaughan, Pia Guerra, José Marzán Jr.","Y: The Last Man, Vol. 10: Whys and Wherefores (Y: The Last Man, #10)"
5367,Greg Bear,"Eon (The Way, #1)"
5368,Helen Simonson,The Summer Before the War
5369,"C.G. Jung, Aniela Jaffé, Richard Winston, Clara Winston","Memories, Dreams, Reflections"
5370,Laurell K. Hamilton,"Bullet (Anita Blake, Vampire Hunter #19)"
5371,Diana Gabaldon,"The Scottish Prisoner (Lord John Grey, #3)"
5372,Meg Cabot,"Reunion (The Mediator, #3)"
5373,ياسر حارب,بيكاسو وستاربكس
5374,"Milan Kundera, Suzanne Rappaport",Laughable Loves
5375,Julia Quinn,"The Secret Diaries of Miss Miranda Cheever (Bevelstoke, #1)"
5376,Founding Fathers,The Constitution of the United States of America
5377,Gilles Néret,Gustav Klimt: 1862-1918
5378,Malcolm Lowry,Under the Volcano
5379,Rachel Abbott,Sleep Tight
5380,"Mary Pope Osborne, Salvatore Murdocca","Dinosaurs Before Dark (Magic Tree House, #1)"
5381,Robert A. Heinlein,Have Space Suit—Will Travel
5382,Jack London,The Sea Wolf
5383,Meg Cabot,"Darkest Hour (The Mediator, #4)"
5384,Kate Beaton,Hark! A Vagrant
5385,Ann Packer,The Dive From Clausen's Pier
5386,"Thomas Mann, Michael Henry Heim, Michael Cunningham",Death in Venice
5387,"Sogyal Rinpoche, Andrew Harvey",The Tibetan Book of Living and Dying
5388,Orson Scott Card,Enchantment
5389,Edgar Allan Poe,The Fall of the House of Usher
5390,D.J. MacHale,"The Soldiers of Halla (Pendragon, #10)"
5391,E. Lockhart,"The Boyfriend List: 15 Guys, 11 Shrink Appointments, 4 Ceramic Frogs and Me, Ruby Oliver (Ruby Oliver, #1)"
5392,Pat Barker,"Regeneration (Regeneration, #1)"
5393,Veronica Roth,"The Initiate (Divergent, #0.2)"
5394,Michael J. Fox,Lucky Man
5395,Margaret Atwood,The Penelopiad
5396,"John Joseph Adams, Robert J. Sawyer, Stephen King, Michael Moorcock, Sharyn McCrumb, Stephen Baxter, Anne Perry, Barbara Hambly, Tanith Lee, Neil Gaiman, Rob Rogers, Naomi Novik, Anthony Burgess, Dominic Green, Laurie R. King, Barbara Roden, Peter Tremayne, Tim Lebbon, Bradley H. Sinor, Edward D. Hoch, Vonda N. McIntyre, Darrell Schweitzer, Mary Robinette Kowal, H.Paul Jeffers, Geoffrey A. Landis, Amy Myers, Tony Pi, Chris Roberson, Mark Valentine",The Improbable Adventures of Sherlock Holmes
5397,Gigi Levangie Grazer,The Starter Wife
5398,"Bill Willingham, Mark Buckingham, Steve Leialoha, James Jean","Fables, Vol. 2: Animal Farm"
5399,"James     Baldwin, Kıvanç Güney",The Fire Next Time
5400,Mo Willems,Don't Let the Pigeon Stay Up Late!
5401,"Grant Morrison, Frank Quitely",We3
5402,Meg Cabot,"Princess in Pink (The Princess Diaries, #5)"
5403,Ellen Schreiber,"The Coffin Club (Vampire Kisses, #5)"
5404,Sinclair Lewis,Main Street
5405,"Rick Riordan, John Rocco",Percy Jackson's Greek Gods (A Percy Jackson and the Olympians Guide)
5406,Catherine Gilbert Murdock,"Dairy Queen (Dairy Queen, #1)"
5407,Michael Chabon,Telegraph Avenue
5408,Karin Slaughter,"Undone (Will Trent, #3)"
5409,Erika Swyler,The Book of Speculation
5410,Laurell K. Hamilton,"Flirt (Anita Blake, Vampire Hunter #18)"
5411,Nora Roberts,"Inner Harbor (Chesapeake Bay Saga, #3)"
5412,Christopher Moore,"Bite Me (A Love Story, #3)"
5413,Frederick Franck,Zen of Seeing: Seeing/Drawing as Meditation
5414,Kristen Britain,"Green Rider (Green Rider, #1)"
5415,Anne McCaffrey,"The Dragonriders of Pern (Dragonriders of Pern, #1-3)"
5416,Helen Oyeyemi,"Boy, Snow, Bird"
5417,Sue Grafton,"E is for Evidence (Kinsey Millhone, #5)"
5418,David  Brooks,"The Social Animal: The Hidden Sources of Love, Character, and Achievement"
5419,Ian McEwan,Solar
5420,Thomas S. Kuhn,The Structure of Scientific Revolutions
5421,Andrea Levy,Small Island
5422,Louise Penny,"A Great Reckoning (Chief Inspector Armand Gamache, #12)"
5423,Sidney Sheldon,The Sky is Falling
5424,Peter M. Senge,The Fifth Discipline: The Art & Practice of The Learning Organization
5425,"Arthur Koestler, Daphne Hardy",Darkness at Noon
5426,Jaci Burton,"The Perfect Play (Play by Play, #1)"
5427,Jane Green,Straight Talking
5428,Jack Campbell,"Dauntless (The Lost Fleet, #1)"
5429,Lois McMaster Bujold,"The Curse of Chalion (World of the Five Gods, #1)"
5430,Elizabeth Flock,Me & Emma
5431,Nora Roberts,"Chesapeake Blue (Chesapeake Bay Saga, #4)"
5432,Malinda Lo,Ash
5433,Bernard Cornwell,"The Burning Land (The Saxon Stories, #5)"
5434,Megan McCafferty,"Second Helpings (Jessica Darling, #2)"
5435,"Diane Arbus, Stan Grossfeld, Doon Arbus, Marvin Israel",Diane Arbus: Monograph
5436,Carolyn Mackler,"The Earth, My Butt, and Other Big Round Things"
5437,Joseph Conrad,Lord Jim
5438,Leo Lionni,A Color of His Own
5439,Neil Gaiman,Don't Panic: The Official Hitchhiker's Guide to the Galaxy Companion
5440,Andrew Clements,"Things Not Seen (Things, #1)"
5441,"Frank E. Peretti, Ted Dekker",House
5442,"V.E. Schwab, Victoria Schwab","Vicious (Villains, #1)"
5443,Clive Cussler,"Raise the Titanic! (Dirk Pitt, #4)"
5444,Eoin Colfer,The Supernaturalist
5445,Meg Cabot,"Queen of Babble in the Big City (Queen of Babble, #2)"
5446,Dr. Seuss,Yertle the Turtle and Other Stories
5447,Camron Wright,The Rent Collector
5448,Rohinton Mistry,Family Matters
5449,Harvey Karp,The Happiest Baby on the Block: The New Way to Calm Crying and Help Your Newborn Baby Sleep Longer
5450,"Penelope Douglas, Nelson Hobbs","Until You (Fall Away, #1.5)"
5451,Dee Lestari,Perahu Kertas
5452,Gordon Korman,Schooled
5453,"Dallas Hartwig, Melissa Hartwig",It Starts with Food: Discover the Whole30 and Change Your Life in Unexpected Ways
5454,Ted Kerasote,Merle's Door: Lessons from a Freethinking Dog
5455,Gary Paulsen,"Brian's Winter (Brian's Saga, #3)"
5456,Julia Alvarez,How the García Girls Lost Their Accents 
5457,"J. Lynn, Jennifer L. Armentrout","Be with Me (Wait for You, #2)"
5458,Louisa May Alcott,"Jo's Boys (Little Women, #3)"
5459,Harlan Coben,Home (Myron Bolitar #11)
5460,Charles Bukowski,Notes of a Dirty Old Man
5461,"Jussi Adler-Olsen, K.E. Semmel","The Absent One (Department Q, #2)"
5462,James McBride,The Good Lord Bird
5463,Susan Cooper,"Greenwitch (The Dark Is Rising, #3)"
5464,"Robert Kirkman, Charlie Adlard, Cliff Rathburn","The Walking Dead, Vol. 05: The Best Defense"
5465,Elizabeth Chandler,"Kissed by an Angel/The Power of Love/Soulmates (Kissed by an Angel, #1-3)"
5466,Abbi Glines,"Take a Chance (Rosemary Beach, #7; Chance, #1)"
5467,Daniel Silva,"Portrait of a Spy (Gabriel Allon, #11)"
5468,Kate Atkinson,"One Good Turn (Jackson Brodie, #2)"
5469,Clive Barker,"Abarat (Abarat, #1)"
5470,Arthur C. Clarke,"2061: Odyssey Three (Space Odyssey, #3)"
5471,"Marshall Goldsmith, Mark Reiter",What Got You Here Won't Get You There: How Successful People Become Even More Successful
5472,Richard Paul Evans,"The Walk (The Walk, #1)"
5473,Claudia Gray,"Afterlife (Evernight, #4)"
5474,Nick Hornby,Slam
5475,Robin LaFevers,"Dark Triumph (His Fair Assassin, #2)"
5476,Kwame Alexander,The Crossover
5477,Andrea Hirata,"Edensor (Tetralogi Laskar Pelangi, #3)"
5478,Alan Hollinghurst,The Line of Beauty
5479,Susanna Kearsley,The Rose Garden
5480,Frank E. Peretti,Monster
5481,Daniel Silva,"The English Assassin (Gabriel Allon, #2)"
5482,Chuck Klosterman,Chuck Klosterman IV: A Decade of Curious People and Dangerous Ideas
5483,Peter F. Drucker,The Effective Executive: The Definitive Guide to Getting the Right Things Done (Harperbusiness Essentials)
5484,"Kieron Gillen, Jamie McKelvie, Matt Wilson, Clayton Cowles","The Wicked + The Divine, Vol. 1: The Faust Act"
5485,Dean Koontz,Innocence
5486,John Sandford,"Dark of the Moon (Virgil Flowers, #1)"
5487,"Esther Hicks, Jerry Hicks",The Law of Attraction: The Basics of the Teachings of Abraham
5488,Alexandra Bracken,"In The Afterlight (The Darkest Minds, #3)"
5489,Aimee Carter,"Goddess Interrupted (Goddess Test, #2)"
5490,"Holly Black, Tony DiTerlizzi","Lucinda's Secret (The Spiderwick Chronicles, #3)"
5491,"Beverly Cleary, Tracy Dockray","Henry Huggins (Henry Huggins, #1)"
5492,"Russell Hoban, Garth Williams",Bedtime for Frances
5493,"Tetsuko Kuroyanagi, Chihiro Iwasaki, Dorothy Britton",Totto-chan: The Little Girl at the Window
5494,Joe Abercrombie,"Half the World (Shattered Sea, #2)"
5495,Roger Lowenstein,When Genius Failed: The Rise and Fall of Long-Term Capital Management
5496,Natalie Goldberg,Writing Down the Bones: Freeing the Writer Within
5497,Darren Shan,"Hunters of the Dusk (Cirque Du Freak, #7)"
5498,Tad Williams,"City of Golden Shadow (Otherland, #1)"
5499,Charlaine Harris,"An Ice Cold Grave (Harper Connelly, #3)"
5500,Katherine Paterson,Jacob Have I Loved
5501,"James Patterson, Liza Marklund",The Postcard Killers
5502,"Julietta Suzuki, Tomo Kimura","Kamisama Kiss, Vol. 1"
5503,Colleen Hoover,"Maybe Not (Maybe, #1.5)"
5504,D.J. MacHale,"Black Water (Pendragon, #5)"
5505,Agatha Christie,"Five Little Pigs (Hercule Poirot, #24)"
5506,China Miéville,Embassytown
5507,Dean Koontz,By the Light of the Moon
5508,Arthur Conan Doyle,"Sherlock Holmes: The Complete Novels and Stories, Volume I"
5509,Dorothy L. Sayers,"Strong Poison (Lord Peter Wimsey, #6)"
5510,Gary Larson,The Far Side Gallery
5511,Julie Kagawa,"The Eternity Cure (Blood of Eden, #2)"
5512,J.D. Robb,"Holiday in Death (In Death, #7)"
5513,Tarryn Fisher,"Thief (Love Me with Lies, #3)"
5514,Aron Ralston,Between a Rock and a Hard Place
5515,David Gemmell,"Legend (The Drenai Saga, #1)"
5516,Sheila Turnage,"Three Times Lucky (Tupelo Landing, #1)"
5517,Meg Cabot,"Every Boy's Got One (Boy, #3)"
5518,Ann Rule,Small Sacrifices: A True Story of Passion and Murder
5519,Chris Bohjalian,The Guest Room
5520,"Avery Monsen, Jory John",All My Friends Are Dead
5521,Matthew Reilly,"The Six Sacred Stones (Jack West Jr, #2)"
5522,Nora Roberts,"Rising Tides (Chesapeake Bay Saga, #2)"
5523,Tite Kubo,"Bleach, Volume 15"
5524,"Johnny Cash, Patrick   Carr",Cash
5525,Sidney Sheldon,A Stranger In The Mirror
5526,Carl Hiaasen,Flush
5527,"Isak Dinesen, Karen Blixen",Out of Africa
5528,Robert Crais,"The Watchman (Elvis Cole, #11; Joe Pike, #1)"
5529,Nassim Nicholas Taleb,Antifragile: Things That Gain from Disorder
5530,Molly McAdams,"From Ashes (From Ashes, #1)"
5531,Sam Harris,Free Will
5532,Marieke Nijkamp,This Is Where It Ends
5533,Rachel Vincent,"Stray (Shifters, #1)"
5534,Elin Hilderbrand,A Summer Affair
5535,Rebecca Stead,Liar & Spy
5536,"Brian Jacques, Gary Chalk","Mariel of Redwall (Redwall, #4)"
5537,Steven Pinker,The Blank Slate: The Modern Denial of Human Nature
5538,Peter F. Hamilton,The Dreaming Void
5539,Meg Cabot,"Being Nikki (Airhead, #2)"
5540,"William Shakespeare, Cynthia Marshall, Barbara A. Mowat, Paul Werstine",Antony and Cleopatra
5541,Margaret Peterson Haddix,"Among the Impostors (Shadow Children, #2)"
5542,Christopher Pike,"Thirst No. 3: The Eternal Dawn (Thirst, #3)"
5543,Zane,Addicted
5544,Kristen Simmons,"Article 5 (Article 5, #1)"
5545,"Randy Shilts, William Greider","And the Band Played On: Politics, People, and the AIDS Epidemic"
5546,Laurelin Paige,"Found in You (Fixed, #2)"
5547,Lara Adrian,"Midnight Rising (Midnight Breed, #4)"
5548,Karin Slaughter,"Kisscut (Grant County, #2)"
5549,"Miranda July, Brigitte Sire",It Chooses You
5550,"Hubert Selby Jr., Gilbert Sorrentino",Last Exit to Brooklyn
5551,"Mario Vargas Llosa, Edith Grossman",The Feast of the Goat
5552,Jordan Sonnenblick,"Drums, Girls & Dangerous Pie (Drums, Girls & Dangerous Pie, #1)"
5553,Miranda July,The First Bad Man
5554,Tad Williams,"To Green Angel Tower, Part 2 (Memory, Sorrow, and Thorn, #3; Part 2)"
5555,Jay Crownover,"Jet (Marked Men, #2)"
5556,John Banville,The Sea
5557,"James Patterson, David Ellis",Invisible
5558,Dean Koontz,Mr. Murder
5559,Gail Carriger,"Changeless (Parasol Protectorate, #2)"
5560,L.E. Modesitt Jr.,The Magic of Recluce (The Saga of Recluce #1)
5561,John Jakes,"The Bastard (Kent Family Chronicles, #1)"
5562,Ben H. Winters,"The Last Policeman (The Last Policeman, #1)"
5563,George R. Stewart,Earth Abides
5564,"Douglas Preston, Lincoln Child",Thunderhead
5565,Darren Shan,"Allies of the Night (Cirque du Freak, #8)"
5566,Thea Harrison,"Dragon Bound (Elder Races, #1)"
5567,L.M. Montgomery,"Rainbow Valley (Anne of Green Gables, #7)"
5568,Stephen King,The Colorado Kid (Hard Case Crime #13)
5569,"Diane Mowat, W.W. Jacobs",The Monkey's Paw (Oxford Bookworms)
5570,John Saul,Darkness
5571,"Jerry Bridges, Foster W. Cline, Jim Fay",The Pursuit of Holiness
5572,Lisa Kleypas,"Again the Magic (Wallflowers, #0)"
5573,Anne Rivers Siddons,Low Country
5574,Jennifer Donnelly,Revolution
5575,Eric S. Nylund,Halo: The Fall of Reach
5576,Kim Harrison,"Ever After (The Hollows, #11)"
5577,Frank De Felitta,Audrey Rose
5578,Nathan  Hill,The Nix
5579,Sophie Jordan,"Vanish (Firelight, #2)"
5580,Bill Watterson,The Calvin and Hobbes Lazy Sunday Book
5581,J. Sheridan Le Fanu,Carmilla
5582,Garth Nix,"Drowned Wednesday (The Keys to the Kingdom, #3)"
5583,Melina Marchetta,Saving Francesca
5584,K.A. Linde,"Avoiding Commitment (Avoiding, #1)"
5585,"James Patterson, Maxine Paetro","Confessions of a Murder Suspect (Confessions, #1)"
5586,"Brian K. Vaughan, Pia Guerra, Goran Sudžuka, José Marzán Jr.","Y: The Last Man, Vol. 6: Girl on Girl (Y: The Last Man, #6)"
5587,Chris Bohjalian,Skeletons at the Feast
5588,Sue Grafton,"L is for Lawless (Kinsey Millhone, #12)"
5589,Jerry Spinelli,Milkweed
5590,"Laura Joffe Numeroff, Felicia Bond",If You Give a Pig a Party
5591,William Gibson,"Virtual Light (Bridge, #1)"
5592,Craig Ferguson,American on Purpose: The Improbable Adventures of an Unlikely Patriot
5593,Michael J. Fox,Always Looking Up: The Adventures of an Incurable Optimist
5594,Sarah MacLean,"Nine Rules to Break When Romancing a Rake (Love By Numbers, #1)"
5595,Charlotte Rogan,The Lifeboat
5596,"Henryk Sienkiewicz, W.S. Kuniczak",Quo Vadis
5597,Amy Ewing,"The Jewel (The Lone City, #1)"
5598,Chris d'Lacey,"The Fire Within (The Last Dragon Chronicles, #1)"
5599,"Raymond E. Feist, Janny Wurts","Servant of the Empire (The Empire Trilogy, #2)"
5600,Nora Roberts,"The Hollow (Sign of Seven, #2)"
5601,"Deborah Guarino, Steven Kellogg",Is Your Mama a Llama?
5602,Anna Todd,"After We Collided (After, #2)"
5603,Jacob Tomsky,"Heads in Beds: A Reckless Memoir of Hotels, Hustles, and So-Called Hospitality"
5604,Tony Horwitz,Confederates in the Attic: Dispatches from the Unfinished Civil War
5605,David Wong,"This Book Is Full of Spiders: Seriously, Dude, Don't Touch It (John Dies at the End, #2)"
5606,"Robert Descharnes, Gilles Néret",Dali: The Paintings
5607,Matthew Reilly,"Seven Deadly Wonders (Jack West Jr, #1)"
5608,Cherrie Lynn,"Unleashed (Ross Siblings, #1)"
5609,Laurell K. Hamilton,"Mistral's Kiss (Merry Gentry, #5)"
5610,Stephen R. Covey,The 8th Habit: From Effectiveness to Greatness
5611,Larissa Ione,Desire Unchained (Demonica #2)
5612,"Dean Koontz, Leigh Nichols",Cold Fire / Hideaway / The Key to Midnight
5613,Dan Wells,"I Am Not A Serial Killer (John Cleaver, #1)"
5614,Laura Dave,Eight Hundred Grapes
5615,Fannie Flagg,"Welcome to the World, Baby Girl! (Elmwood Springs, #1)"
5616,Irvine Welsh,Filth
5617,Lori Lansens,The Girls
5618,Janet Evanovich,"Turbo Twenty-Three (Stephanie Plum, #23)"
5619,Sandra Brown,The Alibi
5620,Wiley Cash,A Land More Kind Than Home
5621,Ann M. Martin,"Kristy's Great Idea (The Baby-Sitters Club, #1)"
5622,Roland Smith,"Shatterproof (The 39 Clues: Cahills vs. Vespers, #4)"
5623,Sheri  Fink,Five Days at Memorial: Life and Death in a Storm-Ravaged Hospital
5624,"Henning Mankell, Steven T. Murray","The Fifth Woman (Kurt Wallander, #6)"
5625,Sarah Vowell,The Wordy Shipmates
5626,"Guy de Maupassant, Douglas Parmée",Bel-Ami
5627,Norman Maclean,A River Runs Through It and Other Stories
5628,"María Dueñas, Daniel Hahn",The Time in Between
5629,Toni Morrison,Paradise
5630,William Gibson,Idoru (Bridge #2)
5631,Kristan Higgins,"The Best Man (Blue Heron, #1)"
5632,Diana Wynne Jones,"Castle in the Air (Howl's Moving Castle, #2)"
5633,Jude Watson,"A King's Ransom (The 39 Clues: Cahills vs. Vespers, #2)"
5634,Deborah Blum,The Poisoner's Handbook: Murder and the Birth of Forensic Medicine in Jazz Age New York
5635,Penelope Ward,RoomHate
5636,Elizabeth Scott,Living Dead Girl
5637,"Anonymous, Ananda Maitreya, Thich Nhat Hanh, Balangoda Ananda Maitreya Maitreya",The Dhammapada
5638,Kristen Ashley,"Law Man (Dream Man, #3)"
