book_id,authors,title
7353,"William Shakespeare, Barbara A. Mowat, Paul Werstine",Measure for Measure
7354,"Owen  West, Dean Koontz",The Mask
7355,Cristin Terrill,All Our Yesterdays
7356,Kimberly Rae Miller,Coming Clean
7357,Kathleen Winsor,Forever Amber 
7358,John  Stephens,"The Emerald Atlas (The Books of Beginning, #1)"
7359,Zadie Smith,Swing Time
7360,Doug Stanton,In Harm's Way: The Sinking of the U.S.S. Indianapolis and the Extraordinary Story of Its Survivors
7361,Yuna Kagesaki,"Chibi Vampire, Vol. 01"
7362,Nina LaCour,Everything Leads to You
7363,Wendy Mass,Jeremy Fink and the Meaning of Life
7364,Patricia Polacco,"Thank You, Mr. Falker"
7365,William Gibson,The Peripheral
7366,Alice Munro,Too Much Happiness
7367,"J. Lynn, Jennifer L. Armentrout","Tempting the Best Man (Gamble Brothers, #1)"
7368,C.S. Pacat,"Captive Prince: Volume Two (Captive Prince, #2)"
7369,Tiffany Reisz,"The Siren (The Original Sinners, #1)"
7370,William  Kennedy,Ironweed
7371,Jonathan Kellerman,"Deception (Alex Delaware, #25)"
7372,Michael Moore,Stupid White Men
7373,Sarah J. Maas,"A Court of Wings and Ruin (A Court of Thorns and Roses, #3)"
7374,Derek Landy,"The Faceless Ones (Skulduggery Pleasant, #3)"
7375,Paul Theroux,The Great Railway Bazaar
7376,Brad Thor,"Black List (Scot Harvath, #11)"
7377,"Warren Ellis, Darick Robertson","Transmetropolitan, Vol. 2: Lust for Life (Transmetropolitan, #2)"
7378,Charles Stross,"The Atrocity Archives (Laundry Files, #1)"
7379,Steve Martin,The Pleasure of My Company
7380,C.J. Sansom,"Dark Fire (Matthew Shardlake, #2)"
7381,Christina Lauren,"Beautiful Beginning (Beautiful Bastard, #3.5)"
7382,Liz Moore,Heft
7383,Brian Jacques,"Outcast of Redwall (Redwall, #8)"
7384,Lloyd Jones,Mister Pip
7385,"Giada De Laurentiis, Victoria Pearson",Giada's Family Dinners
7386,John Patrick Shanley,Doubt
7387,Cate Tiernan,"Book of Shadows (Sweep, #1)"
7388,Beth Harbison,"Secrets of a Shoe Addict (Shoe Addict, #2)"
7389,Anna Todd,"After We Fell (After, #3)"
7390,Laurie Fabiano,Elizabeth Street
7391,Sarah J. Maas,"The Assassin and the Pirate Lord (Throne of Glass, #0.1)"
7392,"Søren Kierkegaard, Alastair Hannay",Fear and Trembling
7393,Amelia Atwater-Rhodes,"Hawksong (The Kiesha'ra, #1)"
7394,Peter F. Hamilton,"The Naked God (Night's Dawn, #3)"
7395,"Peggy Parish, Wallace Tripp","Come Back, Amelia Bedelia"
7396,Thor Heyerdahl,Kon-Tiki: Across The Pacific In A Raft
7397,Mohsin Hamid,How to Get Filthy Rich in Rising Asia
7398,"Albert Einstein, Nigel Calder, Robert W. Lawson",Relativity: The Special and the General Theory
7399,Anna Maxted,Getting Over It
7400,Siobhan Vivian,The List
7401,David James Duncan,The Brothers K
7402,Shawn Achor,The Happiness Advantage: The Seven Principles of Positive Psychology That Fuel Success and Performance at Work
7403,W. Bruce Cameron,"A Dog's Journey (A Dog's Purpose, #2)"
7404,"Timothy J. Keller, Kathy  Keller",The Meaning of Marriage: Facing the Complexities of Commitment with the Wisdom of God
7405,"Grant Morrison, Frank Quitely, Philip Tan, Jonathan Glapion, Alex Sinclair",Batman & Robin: Batman Reborn
7406,Matsuri Hino,"MeruPuri, Vol. 1 (MeruPuri, #1)"
7407,"Arturo Pérez-Reverte, Margaret Jull Costa",The Flanders Panel
7408,"Janet Stevens, Hans Christian Andersen",The Princess and the Pea
7409,"F. Scott Fitzgerald, Matthew J. Bruccoli",The Short Stories
7410,V.C. Andrews,"Dark Angel (Casteel, #2)"
7411,Timothy Zahn,"Specter of the Past (Star Wars: The Hand of Thrawn, #1)"
7412,Tyler Oakley,Binge
7413,Alessandra Torre,Black Lies
7414,Laura Lippman,What the Dead Know
7415,"Jay Crownover, Charlotte Connan de vries","Rome (Marked Men, #3)"
7416,"Laurence Sterne, Melvyn New","The Life and Opinions of Tristram Shandy, Gentleman"
7417,"Giles Andreae, Guy Parker-Rees",Giraffes Can't Dance
7418,Susan Vreeland,The Passion of Artemisia
7419,Louise L. Hay,Heal Your Body: The Mental Causes for Physical Illness and the Metaphysical Way to Overcome Them
7420,"Mia Ikumi, Reiko Yoshida","Tokyo Mew Mew, Vol. 1 (Tokyo Mew Mew, #1)"
7421,Emily M. Danforth,The Miseducation of Cameron Post
7422,"Neil Gaiman, P. Craig Russell",Coraline (Illustrated/Graphic Novel Edition)
7423,Diana Wynne Jones,"House of Many Ways (Howl's Moving Castle, #3)"
7424,Don Winslow,The Cartel
7425,Sue Klebold,A Mother's Reckoning: Living in the Aftermath of Tragedy
7426,Carl Hiaasen,"Skin Tight (Mick Stranahan, #1)"
7427,Ian Fleming,"Moonraker (James Bond, #3)"
7428,"John Locke, Peter Laslett, Raymond Geuss",Two Treatises of Government
7429,Henry David Thoreau,Civil Disobedience and Other Essays
7430,Louisa May Alcott,"Rose in Bloom (Eight Cousins, #2)"
7431,David  Arnold,Mosquitoland
7432,Barbara Claypole White,The Perfect Son
7433,Melina Marchetta,Looking for Alibrandi
7434,Kristen Ashley,"Raid (Unfinished Hero, #3)"
7435,Darynda Jones,"Fifth Grave Past the Light (Charley Davidson, #5)"
7436,Wilbur Smith,"The Seventh Scroll (Ancient Egypt, #2)"
7437,Kody Keplinger,A Midsummer's Nightmare
7438,Nick Cutter,The Troop
7439,C.J. Sansom,"Revelation (Matthew Shardlake, #4)"
7440,"Pablo Neruda, Stephen Tapscott",100 Love Sonnets
7441,Amy Bloom,Lucky Us
7442,Julia Quinn,"It's in His Kiss (Bridgertons, #7)"
7443,"J.K. Rowling, MinaLima","Short Stories from Hogwarts of Power, Politics and Pesky Poltergeists (Pottermore Presents, #2)"
7444,"Georg Wilhelm Friedrich Hegel, A.V. Miller, John Niemeyer Findlay",Phenomenology of Spirit
7445,Kristen Ashley,"Fire Inside (Chaos, #2)"
7446,Peter F. Hamilton,"The Neutronium Alchemist (Night's Dawn, #2)"
7447,Gena Showalter,The Darkest Seduction (Lords of the Underworld #9)
7448,Victoria Aveyard,"King's Cage (Red Queen, #3)"
7449,Paul Auster,Invisible
7450,يوسف زيدان,ظل الأفعى
7451,Sarah Mlynowski,Ten Things We Did (and Probably Shouldn't Have)
7452,Moira Young,"Rebel Heart (Dust Lands, #2)"
7453,Julie Gregory,Sickened: The Memoir of a Munchausen by Proxy Childhood
7454,Anita Shreve,The Last Time They Met
7455,Paulette Jiles,News of the World
7456,Brad Thor,"Blowback (Scot Harvath, #4)"
7457,Devdutt Pattanaik,Jaya: An Illustrated Retelling of the Mahabharata
7458,Gail Tsukiyama,Women of the Silk
7459,Anthony Hope,The Prisoner of Zenda
7460,Amanda Hocking,"Flutter (My Blood Approves, #3)"
7461,Tammy Falkner,"Tall, Tatted and Tempting (The Reed Brothers, #1)"
7462,Paul Auster,Leviathan
7463,David Baldacci,Saving Faith
7464,R.A. Salvatore,"The Spine of the World (Forgotten Realms: Paths of Darkness, #2; Legend of Drizzt, #12)"
7465,R.L. Stine,"The Haunted Mask (Goosebumps, #11)"
7466,Douglas Preston,Tyrannosaur Canyon (Wyman Ford #1)
7467,J.P. Delaney,The Girl Before
7468,Louis Sachar,Wayside School Gets A Little Stranger (Wayside School #3)
7469,Dan Simmons,Summer of Night
7470,"Jim Butcher, Mark Powers, Ardian Syaf","The Dresden Files:  Storm Front, Volume 1-  The Gathering Storm"
7471,Carl Hiaasen,Tourist Season
7472,أحمد خالد توفيق,السنجة
7473,Debbie Macomber,"204 Rosewood Lane (Cedar Cove, #2)"
7474,Karin Slaughter,"Unseen (Will Trent, #7)"
7475,Heather Brewer,"Eleventh Grade Burns (The Chronicles of Vladimir Tod, #4)"
7476,Robert A. Heinlein,Double Star
7477,Alex Kava,"A Perfect Evil (Maggie O'Dell, #1)"
7478,Anne Lamott,Help Thanks Wow: The Three Essential Prayers
7479,"Brian Jacques, Allan Curless","The Long Patrol (Redwall, #10)"
7480,Steven Pinker,The Better Angels of Our Nature: Why Violence Has Declined
7481,"A.A. Milne, Ernest H. Shepard","When We Were Very Young (Winnie-the-Pooh, #3)"
7482,M.O. Walsh,My Sunshine Away
7483,Dee Henderson,The Truth Seeker (O'Malley #3)
7484,Dee Lestari,Filosofi Kopi: Kumpulan Cerita dan Prosa Satu Dekade
7485,"Mika Waltari, ذبیح‌الله منصوری",سینوهه
7486,Nicole Krauss,Great House
7487,Karin Slaughter,"The Kept Woman (Will Trent, #8)"
7488,Marie Force,"Maid for Love (Gansett Island Series, #1)"
7489,Francine Rivers,And the Shofar Blew
7490,Orson Scott Card,"Prentice Alvin (Tales of Alvin Maker, #3)"
7491,Alexander McCall Smith,"44 Scotland Street (44 Scotland Street, #1)"
7492,Sandra Brown,Chill Factor
7493,"Neil Gaiman, Mark Buckingham",Odd and the Frost Giants
7494,Mark  Edwards,The Magpies
7495,"Tayeb Salih, Denys Johnson-Davies",Season of Migration to the North
7496,Doris Lessing,The Golden Notebook
7497,Jennifer Donnelly,"The Winter Rose (The Tea Rose, #2)"
7498,Jeff Shaara,"The Last Full Measure (The Civil War Trilogy, #3)"
7499,Éric-Emmanuel Schmitt,Oscar et la dame rose
7500,Harold S. Kushner,When Bad Things Happen to Good People
7501,Patrick O'Brian,"Post Captain (Aubrey/Maturin, #2)"
7502,Jessica Day George,"Dragon Flight (Dragon Slippers, #2)"
7503,Susan Coolidge,"What Katy Did (Carr Family, #1)"
7504,Robert McCloskey,Homer Price (A Puffin Book)
7505,Tamora Pierce,"Shatterglass (The Circle Opens, #4)"
7506,David Eddings,"The Belgariad, Vol. 1: Pawn of Prophecy / Queen of Sorcery / Magician's Gambit (The Belgariad, #1-3)"
7507,Philip G. Zimbardo,The Lucifer Effect: Understanding How Good People Turn Evil
7508,Nancy Pickard,The Scent of Rain and Lightning
7509,"Clive Cussler, Michael Pritchard","Pacific Vortex! (Dirk Pitt, #1)"
7510,Abbi Glines,"One More Chance (Rosemary Beach, #8; Chance, #2)"
7511,Kim Stanley Robinson,Aurora
7512,J.D. Robb,"Purity in Death (In Death, #15)"
7513,Mary  Stewart,"The Hollow Hills (Arthurian Saga, #2)"
7514,Margaret Peterson Haddix,"Among the Brave (Shadow Children, #5)"
7515,"Rusty Young, Thomas McFadden","Marching Powder: A True Story of Friendship, Cocaine, and South America's Strangest Jail"
7516,Fuyumi Soryo,"Mars, Volume 01"
7517,Richard Feynman,Six Easy Pieces: Essentials of Physics By Its Most Brilliant Teacher
7518,Alice Waters,"The Art of Simple Food: Notes, Lessons, and Recipes from a Delicious Revolution"
7519,Piers Anthony,"Centaur Aisle (Xanth, #4)"
7520,Michelle Richmond,The Year of Fog
7521,"Marv Wolfman, George Pérez",Crisis on Infinite Earths
7522,John Hodgman,The Areas of My Expertise: An Almanac of Complete World Knowledge Compiled with Instructive Annotation and Arranged in Useful Order
7523,J.K. Rowling,"Hogwarts: An Incomplete and Unreliable Guide (Pottermore Presents, #3)"
7524,"Astrid Lindgren, Patricia Crampton, Trina Schart Hyman","Ronia, the Robber's Daughter"
7525,Kathy Reichs,"Spider Bones (Temperance Brennan, #13)"
7526,Andrew Clements,No Talking
7527,"Jo Nesbø, Neil Smith","Blood on Snow (Blood on Snow, #1)"
7528,Elisabeth Naughton,"Wait for Me (Against All Odds, #1)"
7529,Tan Twan Eng,The Garden of Evening Mists
7530,Natasha Preston,"The Cellar (The Cellar, #1)"
7531,Arina Tanemura,"The Gentlemen's Alliance †, Vol. 1"
7532,Alice Clayton,"Rusty Nailed (Cocktail, #2)"
7533,Christine Feehan,"Dark Guardian (Dark, #9)"
7534,Frank E. Peretti,Prophet
7535,Danielle  Paige,"The Wicked Will Rise (Dorothy Must Die, #2)"
7536,Christine Feehan,"Dark Fire (Dark, #6)"
7537,Claudia Rankine,Citizen: An American Lyric
7538,P.G. Wodehouse,"Carry on, Jeeves (Jeeves, #3)"
7539,"Sarah Prineas, Antonio Javier Caparo","The Magic Thief (Magic Thief, #1)"
7540,Michael Azerrad,Our Band Could Be Your Life: Scenes from the American Indie Underground 1981-1991
7541,Rosalind Miles,"I, Elizabeth"
7542,Marian Keyes,The Woman Who Stole My Life
7543,Guy Delisle,Pyongyang: A Journey in North Korea
7544,Ken Follett,Night Over Water
7545,Courtney Maum,I Am Having So Much Fun Here Without You
7546,Cecily von Ziegesar,"All I Want is Everything (Gossip Girl, #3)"
7547,Michael E. Porter,Competitive Strategy: Techniques for Analyzing Industries and Competitors
7548,Wayne A. Grudem,Systematic Theology: An Introduction to Biblical Doctrine
7549,Sue Grafton,"P is for Peril (Kinsey Millhone, #16)"
7550,Sarah Andersen,"Adulthood Is a Myth (Sarah's Scribbles, #1)"
7551,R. Scott Bakker,"The Darkness That Comes Before (The Prince of Nothing, #1)"
7552,Kristin Kimball,"The Dirty Life: On Farming, Food, and Love"
7553,Jonathan Maberry,"Dust & Decay (Rot & Ruin, #2)"
7554,Melissa Landers,"Alienated (Alienated, #1)"
7555,Laura Ruby,Bone Gap
7556,Adriana Trigiani,"Big Cherry Holler (Big Stone Gap, #2)"
7557,Marcus Samuelsson,"Yes, Chef"
7558,Meg Cabot,Teen Idol
7559,Chimamanda Ngozi Adichie,The Thing Around Your Neck
7560,Stephanie Garber,Caraval
7561,James Frey,Bright Shiny Morning
7562,Kate Chopin,The Story of an Hour
7563,John Updike,Rabbit Is Rich (Rabbit Angstrom #3)
7564,Anna Quindlen,"Lots of Candles, Plenty of Cake"
7565,Cheryl Rainfield,Scars
7566,Mary Kay Andrews,The Fixer Upper
7567,Ahmad Fuadi,"Negeri 5 Menara (Negeri 5 Menara, #1)"
7568,Naomi Novik,"Empire of Ivory (Temeraire, #4)"
7569,Rick Atkinson,"An Army at Dawn: The War in North Africa, 1942-1943 (World War II Liberation Trilogy, #1)"
7570,Mary Higgins Clark,Daddy's Little Girl
7571,Sandra Brown,Ricochet
7572,Fannie Flagg,Can't Wait to Get to Heaven
7573,Jo Walton,Among Others
7574,J.D. Robb,"Seduction in Death (In Death, #13)"
7575,James M. Cain,Double Indemnity
7576,Sherrilyn Kenyon,"Upon the Midnight Clear (Dark-Hunter #12, Dream-Hunter #2)"
7577,Garr Reynolds,Presentation Zen: Simple Ideas on Presentation Design and Delivery
7578,R.A. Salvatore,"Sea of Swords (Forgotten Realms: Paths of Darkness, #4; Legend of Drizzt, #13)"
7579,Philip Roth,"Goodbye, Columbus and Five Short Stories"
7580,"Tom Sniegoski, Jeff Smith, Thomas E. Sniegoski, Steve Hamaker","Bone: Quest for the Spark, Vol. 1"
7581,Josh Kaufman,The Personal MBA: Master the Art of Business
7582,Dorothea Benton Frank,The Last Original Wife
7583,Sherrilyn Kenyon,"No Mercy (Dark-Hunter #18, Were-Hunter, #5)"
7584,Scott  Hawkins,The Library at Mount Char
7585,Chris d'Lacey,"Fire Star (The Last Dragon Chronicles, #3)"
7586,James A. Michener,Texas
7587,Joel Osteen,Your Best Life Now: 7 Steps to Living at Your Full Potential
7588,Jennifer L. Holm,Turtle in Paradise
7589,Lois McMaster Bujold,"The Vor Game (Vorkosigan Saga, #6)"
7590,"Mary Beth Chapman, Steven Curtis Chapman",Choosing to SEE
7591,Lauren Beukes,Broken Monsters
7592,"Sylvia Plath, Karen V. Kukil",The Unabridged Journals of Sylvia Plath
7593,David Foster Wallace,"This Is Water: Some Thoughts, Delivered on a Significant Occasion, about Living a Compassionate Life"
7594,Richard Feynman,QED: The Strange Theory of Light and Matter
7595,"Lili St. Crow, Lilith Saintcrow","Defiance (Strange Angels, #4)"
7596,Kelley Armstrong,"Haunted (Women of the Otherworld, #5)"
7597,Jill Conner Browne,The Sweet Potato Queens' Book of Love
7598,Tamora Pierce,"Mastiff (Beka Cooper, #3)"
7599,Debra Dean,The Madonnas of Leningrad
7600,Laurell K. Hamilton,"Divine Misdemeanors (Merry Gentry, #8)"
7601,Chelsea Cain,"Sweetheart (Archie Sheridan & Gretchen Lowell, #2)"
7602,José Saramago,Caim
7603,William Gibson,"All Tomorrow's Parties (Bridge, #3)"
7604,Hannu Rajaniemi,"The Quantum Thief (Jean le Flambeur, #1)"
7605,John Sandford,"Shock Wave (Virgil Flowers, #5)"
7606,Ludwig Wittgenstein,Tractatus Logico-Philosophicus
7607,Agatha Christie,"Lord Edgware Dies (Hercule Poirot, #9)"
7608,"Jeph Loeb, Jim Lee, Scott Williams","Batman: Hush, Vol. 2"
7609,Spencer Quinn,Dog on It (A Chet and Bernie Mystery #1)
7610,Mary Kay Andrews,Spring Fever
7611,Dr. Seuss,And to Think That I Saw it on Mulberry Street
7612,Doris Kearns Goodwin,"The Bully Pulpit: Theodore Roosevelt, William Howard Taft, and the Golden Age of Journalism"
7613,Brandon Mull,"Chasing the Prophecy (Beyonders, #3)"
7614,David Weber,"The Short Victorious War (Honor Harrington, #3)"
7615,Caroline Knapp,Drinking: A Love Story
7616,Jules Verne,"Five Weeks in a Balloon (Extraordinary Voyages, #1)"
7617,"P.C. Cast, Kristin Cast","Dragon's Oath (House of Night Novellas, #1)"
7618,Kalayna Price,"Grave Witch (Alex Craft, #1)"
7619,Agatha Christie,"Sleeping Murder (Miss Marple, #13)"
7620,"Edith Wharton, Mary Gordon",Ethan Frome and Other Short Fiction
7621,Sarah J. Maas,"The Assassin and the Desert (Throne of Glass, #0.3)"
7622,"Friedrich Nietzsche, Walter Kaufmann, R.J. Hollingdale",On the Genealogy of Morals/Ecce Homo
7623,Steven Callahan,Adrift: Seventy-Six Days Lost at Sea
7624,Judith McNaught,"Once and Always (Sequels, #1)"
7625,James Rollins,"Bloodline (Sigma Force, #8)"
7626,Lisi Harrison,"Best Friends for Never (The Clique, #2)"
7627,Bernard Cornwell,"Death of Kings (The Saxon Stories, #6)"
7628,"Howard Schultz, Joanne Gordon",Onward: How Starbucks Fought for Its Life without Losing Its Soul
7629,Laurence Rees,Auschwitz
7630,Slavomir Rawicz,The Long Walk: The True Story of a Trek to Freedom
7631,Nora Roberts,Three Fates
7632,Alexandra Bracken,"Passenger (Passenger, #1)"
7633,"J.D. Robb, Susan Ericksen","Born in Death (In Death, #23)"
7634,Chris Bohjalian,"Close Your Eyes, Hold Hands"
7635,Agatha Christie,"A Pocket Full of Rye (Miss Marple, #7)"
7636,"Durjoy Datta, Maanvi Ahuja",Of Course I Love You...! Till I Find Someone Better...
7637,Robyn Carr,"Virgin River (Virgin River, #1)"
7638,Iain M. Banks,The Algebraist
7639,"José Mauro de Vasconcelos, قاسم صنعوی",درخت زیبای من
7640,Margaret Atwood,Stone Mattress: Nine Tales
7641,Ivan Doig,The Whistling Season
7642,"Morgan Rhodes, Michelle Rowen","Rebel Spring (Falling Kingdoms, #2)"
7643,"James Patterson, Marshall Karp","NYPD Red 2 (NYPD Red, #2)"
7644,James A. Michener,Chesapeake
7645,Steve Martini,The List
7646,Gloria Levine,Ralph S. Mouse by Beverly Cleary: Teacher Guide (Novel Units)
7647,Walter Mosley,"Devil in a Blue Dress (Easy Rawlins, #1)"
7648,"Michael Rosen, Jane Ray",Shakespeare's Romeo and Juliet
7649,Jim Thompson,The Killer Inside Me
7650,Mary Elizabeth Braddon,Lady Audley's Secret
7651,"José Saramago, Margaret Jull Costa",All the Names
7652,Adriana Trigiani,"Lucia, Lucia"
7653,Jodi Lynn Anderson,Tiger Lily
7654,"Karen Kingsbury, Gary Smalley","Return (Redemption, #3)"
7655,Philip Pullman,"The Ruby in the Smoke (Sally Lockhart, #1)"
7656,Amanda Foreman,Georgiana: Duchess of Devonshire
7657,A.C. Gaughen,"Scarlet (Scarlet, #1)"
7658,Miranda Kenneally,Stealing Parker
7659,Mary Kay Andrews,The Weekenders
7660,"Bill Willingham, Mark Buckingham, Steve Leialoha, Tony Akins, Jimmy Palmiotti","Fables, Vol. 5: The Mean Seasons"
7661,Machado de Assis,Dom Casmurro
7662,"Robert Shea, Robert Anton Wilson",The Illuminatus! Trilogy
7663,Alexander Gordon Smith,"Lockdown (Escape from Furnace, #1)"
7664,"Michael Chabon, Jay Ryan",The Final Solution
7665,Nancy Thayer,Beachcombers
7666,"John Layman, Rob Guillory","Chew, Vol. 2: International Flavor"
7667,Poppy Z. Brite,Lost Souls
7668,Joseph Conrad,The Secret Agent
7669,Alan W. Watts,The Way of Zen
7670,Ramez Naam,"Nexus (Nexus, #1)"
7671,Kathleen E. Woodiwiss,The Wolf and the Dove
7672,Veronica Roth,"The Traitor (Divergent, #0.4)"
7673,Colm Tóibín,Nora Webster
7674,Jamie McGuire,"Requiem (Providence, #2)"
7675,Steve Berry,"The Emperor's Tomb (Cotton Malone, #6)"
7676,Lisa Gardner,"Fear Nothing (Detective D.D. Warren, #7)"
7677,"Dorie Greenspan, Alan    Richardson",Baking: From My Home to Yours
7678,Jane Green,Promises to Keep
7679,Kristen Ashley,"For You (The 'Burg, #1)"
7680,"Aya Nakahara, Pookie Rolf","Love★Com, Vol. 1"
7681,Agatha Christie,"Elephants Can Remember (Hercule Poirot, #37)"
7682,Belle Aurora,"Friend-Zoned (Friend-Zoned, #1)"
7683,"Heidi Murkoff, Sharon Mazel, Heidi Murkoff, Arlene Eisenberg, Sandee Hathaway, Mark D. Widome",What to Expect the First Year (What to Expect)
7684,Danielle Steel,The Gift
7685,Kristin Levine,The Lions of Little Rock
7686,Phillip C. McGraw,Self Matters: Creating Your Life from the Inside Out
7687,Amanda Hocking,"Hollowland (The Hollows, #1)"
7688,Hidekaz Himaruya,"Hetalia: Axis Powers, Vol. 1 (Hetalia: Axis Powers, #1)"
7689,"Andrew Stanton, Walt Disney Company",Finding Nemo
7690,"Herman Parish, Lynn Sweat",Calling Doctor Amelia Bedelia
7691,Gail Carriger,"Timeless (Parasol Protectorate, #5)"
7692,Jan Karon,"These High, Green Hills (Mitford Years, #3)"
7693,"Eric Schmidt, Jonathan Rosenberg",How Google Works
7694,J.A. Redmerski,"Killing Sarai (In the Company of Killers, #1)"
7695,Cecelia Ahern,The Time of My Life
7696,"A.A. Milne, Ernest H. Shepard","Now We Are Six (Winnie-the-Pooh, #4)"
7697,L.J. Smith,"The Captive Part II / The Power (The Secret Circle, #2-3)"
7698,Mary Kay Andrews,Ladies' Night
7699,Jane Green,Family Pictures 
7700,Lara Adrian,"Taken by Midnight (Midnight Breed, #8)"
7701,"José Maria de Eça de Queirós, Ester de Lemos",Os Maias
7702,Amy Harmon,"The Law of Moses (The Law of Moses, #1)"
7703,Amy Gentry,Good as Gone
7704,Nora Roberts,Holding the Dream (Dream Trilogy #2)
7705,Tijan,"Fallen Crest Family (Fallen Crest High, #2)"
7706,Amanda Grange,"Mr. Darcy's Diary (Jane Austen Heroes, #1)"
7707,Robert Crais,"L.A. Requiem (Elvis Cole, #8)"
7708,Joshilyn Jackson,A Grown-Up Kind of Pretty
7709,Miranda Hart,Is It Just Me?
7710,Kent Haruf,"Eventide (Plainsong, #2)"
7711,"Tim Hamilton, Ray Bradbury",Fahrenheit 451: The Authorized Adaptation
7712,Maki Minami,"Special A, Vol. 1 (Special A, #1)"
7713,"Hiroshi Sakurazaka, 桜坂洋, Alexander O. Smith, Joseph Reeder",All You Need Is Kill
7714,Elizabeth George Speare,The Bronze Bow
7715,Alain de Botton,On Love
7716,Jonathan Harr,A Civil Action
7717,Wanda Gág,Millions of Cats
7718,Christine Feehan,"Dark Challenge (Dark, #5)"
7719,"James Patterson, David Ellis",Mistress
7720,Allen Say,Grandfather's Journey
7721,Mary Kay Andrews,"Savannah Blues (Weezie and Bebe Mysteries, #1)"
7722,James Rollins,Excavation
7723,"René Descartes, Donald A. Cress",Discourse on Method
7724,Matthew Reilly,"Scarecrow (Shane Schofield, #3)"
7725,Kiersten White,"Endlessly (Paranormalcy, #3)"
7726,Ella Carey,The House by the Lake
7727,Thich Nhat Hanh,"Living Buddha, Living Christ"
7728,Ursula K. Le Guin,The Earthsea Trilogy
7729,Jessica Park,"Left Drowning (Left Drowning, #1)"
7730,"Philip C. Stead, Erin E. Stead",A Sick Day for Amos McGee
7731,Smith Henderson,Fourth of July Creek
7732,Lisa Jackson,"Absolute Fear (New Orleans, #4)"
7733,Greg Iles,True Evil
7734,"Erskine Caldwell, Lewis Nordan",Tobacco Road (Brown Thrasher Books)
7735,Kate Summerscale,The Suspicions of Mr. Whicher: A Shocking Murder and the Undoing of a Great Victorian Detective
7736,Loretta Chase,"Lord of Scoundrels (Scoundrels, #3)"
7737,L. Frank Baum,"Ozma of Oz (Oz, #3)"
7738,David McCullough,The Johnstown Flood
7739,Glenn Beck,The Christmas Sweater
7740,Rachel Renée Russell,"Tales from a Not-So-Happy Heartbreaker (Dork Diaries, #6)"
7741,James Rollins,Deep Fathom
7742,Nelson DeMille,The Gate House
7743,"J. Lynn, Jennifer L. Armentrout","Stay with Me (Wait for You, #3)"
7744,Sylvia Day,Seven Years to Sin
7745,Ally Carter,"Perfect Scoundrels (Heist Society, #3)"
7746,"Larry Bird, Earvin Johnson, Jackie MacMullan",When the Game Was Ours
7747,R.A. Salvatore,"The Two Swords (Forgotten Realms: Hunter's Blades, #3; Legend of Drizzt, #16)"
7748,Agatha Christie,"Nemesis (Miss Marple, #12)"
7749,Douglas Coupland,All Families are Psychotic
7750,Tony Hillerman,"The Blessing Way (Leaphorn & Chee, #1)"
7751,Jane Green,Another Piece of My Heart
7752,Camilla Läckberg,"Stenhuggaren (Patrik Hedström, #3)"
7753,Mo Willems,The Pigeon Wants a Puppy!
7754,David  Brooks,The Road to Character
7755,"Gabriel García Márquez, Edith Grossman",The General in His Labyrinth
7756,Mario Vargas Llosa,La ciudad y los perros
7757,Cammie McGovern,Say What You Will
7758,Tess Gerritsen,"Die Again (Rizzoli & Isles, #11)"
7759,Meg Cabot,"Party Princess (The Princess Diaries, #7)"
7760,H.M. Ward,"Damaged 2 (Damaged, #2)"
7761,Sandra Brown,The Witness
7762,Susan Abulhawa,Mornings in Jenin
7763,Melissa Nathan,The Nanny
7764,Katy Evans,"Manwhore (Manwhore, #1)"
7765,Peter Clines,"Ex-Heroes (Ex-Heroes, #1)"
7766,Alastair Reynolds,Absolution Gap
7767,Enid Blyton,The Faraway Tree Stories (The Faraway Tree #1-3)
7768,Misty Bernall,She Said Yes: The Unlikely Martyrdom of Cassie Bernall
7769,Evelyn Waugh,Scoop
7770,Rita Golden Gelman,Tales of a Female Nomad: Living at Large in the World
7771,Lorrie Moore,Birds of America
7772,Lauren Blakely,Big Rock
7773,Kendare Blake,"Three Dark Crowns (Three Dark Crowns, #1)"
7774,Elizabeth Bard,"Lunch in Paris: A Love Story, with Recipes"
7775,John Jakes,"Love and War (North and South, #2)"
7776,Aprilynne Pike,"Destined (Wings, #4)"
7777,"David Foster Wallace, Michael Pietsch",The Pale King
7778,"Confucius, D.C. Lau",The Analects
7779,"Pamela Des Barres, Dave Navarro",I'm with the Band: Confessions of a Groupie
7780,Richelle Mead,"Succubus Heat (Georgina Kincaid, #4)"
7781,"Robert Kirkman, Charlie Adlard, Cliff Rathburn","The Walking Dead, Vol. 09: Here We Remain"
7782,Mariana Zapata,Under Locke
7783,"Giuseppe Tomasi di Lampedusa, Archibald Colquhoun",The Leopard
7784,"Paul Jenkins, Andy Kubert, Richard Isanove, Joe Quesada, Bill Jemas",Wolverine: Origin
7785,V.C. Andrews,"Dawn (Cutler, #1)"
7786,"Patricia Briggs, Eileen Wilks, Karen Chance, Sunny","On the Prowl (Alpha & Omega, #0.5)"
7787,John Sandford,Silent Prey (Lucas Davenport #4)
7788,Sara Douglass,"The Wayfarer Redemption (Wayfarer Redemption, #1)"
7789,Sandra Gulland,"The Many Lives & Secret Sorrows of Josephine B. (Josephine Bonaparte, #1)"
7790,حسن الجندي,الجزار
7791,Lisa Scottoline,Come Home
7792,Adam Gidwitz,"A Tale Dark & Grimm (A Tale Dark & Grimm, #1)"
7793,Trudi Canavan,"The Ambassador's Mission (Traitor Spy Trilogy, #1)"
7794,Philip Roth,Everyman
7795,Dee Lestari,Supernova: Akar
7796,"Alisa Valdes, Alisa Valdes-Rodriguez","The Dirty Girls Social Club (Dirty Girls, #1)"
7797,L.J. Smith,"Dark Reunion (The Vampire Diaries, #4)"
7798,Luke Rhinehart,The Dice Man
